id,gender,masterCategory,subCategory,articleType,baseColour,year,usage,productDisplayName
17993,Women,Apparel,Bottomwear,Track Pants,Grey,2009,Sports,Puma Women Essential Skinny Grey Track Pant
17994,Women,Apparel,Bottomwear,Track Pants,Navy Blue,2009,Sports,Puma Women Essential Skinny Navy Blue Track Pant
54076,Unisex,Footwear,Shoes,Casual Shoes,Brown,2010,Casual,ADIDAS Unisex Brown Casual Shoes
18795,Unisex,Accessories,Bags,Laptop Bag,Beige,2010,Casual,Peter England Unisex Casual Beige Bag
1728,Unisex,Footwear,Shoes,Sports Shoes,Green,2010,Sports,Newfeel Unisex Green Sports Shoes
1638,Unisex,Apparel,Bottomwear,Swimwear,Blue,2010,Sports,Nabaiji Swimming Goggles Blue Black
3464,Unisex,Apparel,Apparel Set,Swimwear,Blue,2010,Sports,ADIDAS Kid's Light Aqua Swimming Cap
3465,Unisex,Apparel,Apparel Set,Swimwear,Black,2010,Sports,ADIDAS Unisex Black White Swimming Cap
2584,Unisex,Apparel,Bottomwear,Track Pants,Black,2010,Sports,Kalenji Unisex Tight Black Track Pant
51320,Unisex,Accessories,Accessories,Travel Accessory,Black,2010,Casual,Wildcraft Unisex Black Travel Pouch
51330,Unisex,Accessories,Accessories,Travel Accessory,Black,2010,Casual,Wildcraft Unisex Black Rain Cover for Backpacks
58525,Unisex,Accessories,Accessories,Travel Accessory,Green,2010,Casual,Wildcraft Unisex Green Chalk Bag
1803,Unisex,Apparel,Topwear,Tshirts,Black,2010,Sports,Tribord Unisex Black T-shirt
1611,Women,Apparel,Topwear,Jackets,Black,2010,Sports,Reebok Knit Rib Women Black Jacket
51618,Women,Apparel,Bottomwear,Jeggings,Blue,2010,Casual,Kraus Jeans Women Blue Jeggings
53859,Women,Apparel,Topwear,Kurtas,Green,2010,Ethnic,Vishudh Women Green Kurta
59058,Women,Apparel,Topwear,Kurtis,Black,2010,Ethnic,Global Desi Women Black Kurti
54059,Women,Apparel,Bottomwear,Leggings,White,2010,Casual,Myntra Women White Leggings
57922,Women,Apparel,Bottomwear,Leggings,Purple,2010,Casual,Femella Women Purple Leggings
17992,Women,Apparel,Loungewear and Nightwear,Lounge Pants,Black,2010,Sports,Puma Women Essential Skinny Black Track Pant
47071,Women,Apparel,Bottomwear,Patiala,Rust,2010,Ethnic,Shree Women Rust & Red Patiala
42313,Women,Apparel,Saree,Sarees,Beige,2010,Ethnic,Prafful Belge & Red Crepe Printed Saree
59901,Women,Accessories,Scarves,Scarves,Grey,2010,Casual,Femella Women Grey Scarf
2119,Women,Apparel,Topwear,Shirts,Pink,2010,Casual,Lee Women Pink Shirt
2121,Women,Apparel,Topwear,Shirts,Black,2010,Casual,Lee Women Black Shirt
2125,Women,Apparel,Topwear,Shirts,White,2010,Casual,Lee Women White Shirt
57895,Women,Apparel,Topwear,Shirts,Pink,2010,Casual,Femella Women Pink Top
57981,Women,Apparel,Topwear,Shirts,Red,2010,Casual,Latin Quarters Women Red Check Shirt
1981,Women,Apparel,Bottomwear,Shorts,Green,2010,Casual,Puma Women's Island Green Shorts
1982,Women,Apparel,Bottomwear,Shorts,Purple,2010,Casual,Puma Women's Island Shorts Purple
49635,Women,Apparel,Bottomwear,Skirts,Pink,2010,Casual,Mineral Women Pink Skirt
1730,Women,Footwear,Shoes,Sports Shoes,Black,2010,Sports,Reebok Women Black Pink Frisker Shoe
1731,Women,Footwear,Shoes,Sports Shoes,White,2010,Sports,Reebok Women White Blue Frisker Shoes
1923,Women,Footwear,Shoes,Sports Shoes,White,2010,Sports,Kalenji Women Running Shoe
1937,Women,Footwear,Shoes,Sports Shoes,Black,2010,Sports,Kalenji Women Black Pink Shoe
3162,Women,Footwear,Shoes,Sports Shoes,White,2010,Sports,Nike Women Downshifter White Blue Shoe
3163,Women,Footwear,Shoes,Sports Shoes,Grey,2010,Sports,Nike Women Downshifter Grey Black Shoe
3223,Women,Footwear,Shoes,Sports Shoes,Multi,2010,Sports,Puma Women Axis Pink Dark Shadow Shoe
3237,Women,Footwear,Shoes,Sports Shoes,White,2010,Sports,Puma Women Espera White Red Shoe
3492,Women,Footwear,Shoes,Sports Shoes,Red,2010,Sports,ADIDAS Women Adi Light Red White Shoe
6641,Women,Footwear,Shoes,Sports Shoes,Grey,2010,Sports,Nike Women's Lunarelite Grey Orange Shoe
1609,Women,Apparel,Topwear,Sweatshirts,Pink,2010,Sports,Reebok Women Boat-Neck Wildberry Sweatshirt
2268,Women,Apparel,Topwear,Sweatshirts,Grey,2010,Sports,Nike Grey Women Sweatshirt
1580,Women,Apparel,Bottomwear,Swimwear,Black,2010,Sports,Nabaiji Women Cross-back Swimsuit
1583,Women,Apparel,Bottomwear,Swimwear,Black,2010,Sports,Nabaiji Women Black Swimsuit
2247,Women,Apparel,Apparel Set,Swimwear,Purple,2010,Sports,ADIDAS Women Swimming Purple Cap
1978,Women,Apparel,Topwear,Tops,Yellow,2010,Casual,Puma Women Yellow Sleeveless Top
2120,Women,Apparel,Topwear,Tops,Navy Blue,2010,Casual,Lee Women Navy Blue Top
2122,Women,Apparel,Topwear,Tops,Black,2010,Casual,Lee Women Black Top
2123,Women,Apparel,Topwear,Tops,Blue,2010,Casual,Lee Women Blue Top
2294,Women,Apparel,Topwear,Tops,White,2010,Sports,Nike Women's Miller Top
2915,Women,Apparel,Topwear,Tops,White,2010,Casual,DUSG Women Bandhavgarh Organic Aqua Top
2916,Women,Apparel,Topwear,Tops,Yellow,2010,Casual,DUSG Women Reuse Reduce Bamboo Yellow Top
2938,Women,Apparel,Topwear,Tops,Multi,2010,Casual,DUSG Women Crane Bamboo Top
2940,Women,Apparel,Topwear,Tops,Maroon,2010,Casual,DUSG Women Peacock Ladies Organic Cotton Top
2947,Women,Apparel,Topwear,Tops,Yellow,2010,Casual,DUSG Women Uttarkashi Organic Endive Top
2956,Women,Apparel,Topwear,Tops,Yellow,2010,Casual,DUSG Women Rishikesh Organic Wheat Top
43617,Women,Apparel,Topwear,Tops,Pink,2010,Casual,Vero Moda Women Pink Top
59400,Women,Apparel,Topwear,Tops,Grey,2010,Casual,Tokyo Talkies Women Grey Top
1573,Women,Apparel,Bottomwear,Track Pants,Grey,2010,Sports,Kalenji Women Athletes Grey Track Pants
1604,Women,Apparel,Bottomwear,Track Pants,Blue,2010,Sports,Reebok Track Pants Women Blue
1605,Women,Apparel,Bottomwear,Track Pants,Black,2010,Sports,Reebok Black Track Pant
1764,Women,Apparel,Bottomwear,Track Pants,Black,2010,Sports,Lotto Women Mid Cathy Track Pants
2109,Women,Apparel,Bottomwear,Track Pants,Black,2010,Sports,ADIDAS Women's Slim Fit Lycra Track Pants
2110,Women,Apparel,Bottomwear,Track Pants,Tan,2010,Sports,ADIDAS Women Very Berry Lycra Track Pants
2111,Women,Apparel,Bottomwear,Track Pants,Black,2010,Sports,ADIDAS Women's Sunset Lycra Fit Track Pants
2112,Women,Apparel,Bottomwear,Track Pants,Black,2010,Sports,ADIDAS Women's Essential Black Capris
2113,Women,Apparel,Bottomwear,Track Pants,Grey,2010,Sports,ADIDAS Women's Essential Cinder Grey Capris
2114,Women,Apparel,Bottomwear,Track Pants,Black,2010,Sports,ADIDAS Women Essential Black Candy Pants
2223,Women,Apparel,Bottomwear,Track Pants,Black,2010,Sports,ADIDAS Women Stripe Black Track Pant
2226,Women,Apparel,Bottomwear,Track Pants,Black,2010,Sports,ADIDAS Women Black Tracksuit
17995,Women,Apparel,Bottomwear,Track Pants,Grey,2010,Sports,Puma Women Essential Skinny Grey Track Pant
18006,Women,Apparel,Bottomwear,Track Pants,Black,2010,Sports,Puma Women Jersey Black Track Pant
18644,Women,Apparel,Bottomwear,Track Pants,Red,2010,Sports,Puma Women Geranium Red Core Sweatpants
1561,Women,Apparel,Topwear,Tshirts,White,2010,Sports,Quechua Women Sweat Proof White T-shirt
1570,Women,Apparel,Topwear,Tshirts,Black,2010,Sports,Artengo Women Tennis Singlet
1651,Women,Apparel,Topwear,Tshirts,Pink,2010,Sports,Domyos Women Style Pink T-shirt
1762,Women,Apparel,Topwear,Tshirts,Blue,2010,Sports,Lotto Women Cathy Blue T-shirt
1765,Women,Apparel,Topwear,Tshirts,White,2010,Casual,Lotto Women White T-shirt
1809,Women,Apparel,Topwear,Tshirts,Blue,2010,Sports,Decathlon Profilter Women Blue T-shirt
1983,Women,Apparel,Topwear,Tshirts,Blue,2010,Casual,ADIDAS Women Graphic Blue T-shirt
1984,Women,Apparel,Topwear,Tshirts,White,2010,Sports,ADIDAS Women Graphic White T-shirt
1985,Women,Apparel,Topwear,Tshirts,Red,2010,Casual,ADIDAS Womens Classic Red T-shirt
1986,Women,Apparel,Topwear,Tshirts,Blue,2010,Sports,ADIDAS Womens Blue V Neck T-shirt
1988,Women,Apparel,Topwear,Tshirts,Red,2010,Sports,ADIDAS Womens Red Tank T-shirt
1989,Women,Apparel,Topwear,Tshirts,Black,2010,Sports,ADIDAS Womens Black Tank Fitted T-shirt
1991,Women,Apparel,Topwear,Tshirts,Blue,2010,Casual,ADIDAS Womens Blue  Polo T-shirt
1993,Women,Apparel,Topwear,Tshirts,Grey,2010,Casual,Puma Women Femme Fatale T-shirt
1994,Women,Apparel,Topwear,Tshirts,Yellow,2010,Sports,Puma Women's Powergirls T-shirt
2002,Women,Apparel,Topwear,Tshirts,Yellow,2010,Sports,PUMA Women Yellow Printed T-shirt
2065,Women,Apparel,Topwear,Tshirts,Black,2010,Sports,ADIDAS Women Polo Black Polo T-shirt
2069,Women,Apparel,Topwear,Tshirts,White,2010,Sports,ADIDAS Womens Tank White T-shirt
2078,Women,Apparel,Topwear,Tshirts,Black,2010,Sports,ADIDAS Women Fitted Black T-shirt
2124,Women,Apparel,Topwear,Tshirts,Black,2010,Casual,Lee Women Black T-shirt
2244,Women,Apparel,Topwear,Tshirts,Black,2010,Casual,ADIDAS Women's Black T-shirt
2245,Women,Apparel,Topwear,Tshirts,White,2010,Sports,ADIDAS Women White Polo T-shirt
2254,Women,Apparel,Topwear,Tshirts,Purple,2010,Casual,ADIDAS Women Purple Top
2265,Women,Apparel,Topwear,Tshirts,Orange,2010,Sports,Nike Womens NIKE MILER SS TOP T-shirt
2266,Women,Apparel,Topwear,Tshirts,Green,2010,Sports,Nike Green Women T-shirt
2267,Women,Apparel,Topwear,Tshirts,Pink,2010,Sports,Nike Pink Women T-shirt
2269,Women,Apparel,Topwear,Tshirts,Green,2010,Sports,Nike Light Green Women T-shirt
2270,Women,Apparel,Topwear,Tshirts,Pink,2010,Casual,Nike JDI Pink Women T-shirt
2280,Women,Apparel,Topwear,Tshirts,Pink,2010,Sports,Nike Womens Sphere Pink T-shirt
2288,Women,Apparel,Topwear,Tshirts,Black,2010,Sports,Nike Women Black T-shirt
2289,Women,Apparel,Topwear,Tshirts,Blue,2010,Sports,Nike Women Blue T-shirt
2290,Women,Apparel,Topwear,Tshirts,Pink,2010,Sports,Nike Women SS Pink T-shirt
2292,Women,Apparel,Topwear,Tshirts,Black,2010,Sports,Nike Women Accuracy Black T-shirt
2293,Women,Apparel,Topwear,Tshirts,Pink,2010,Casual,Nike Women Accuracy Pink T-shirt
2295,Women,Apparel,Topwear,Tshirts,Pink,2010,Sports,Nike Women Cruiser Pink T-shirt
2296,Women,Apparel,Topwear,Tshirts,Black,2010,Sports,Nike Women DPT Black T-shirt
2297,Women,Apparel,Topwear,Tshirts,Pink,2010,Sports,Nike Women DPT Pink T-shirt
2299,Women,Apparel,Topwear,Tshirts,Purple,2010,Sports,Nike Women Purple Polo T-shirt
2300,Women,Apparel,Topwear,Tshirts,Pink,2010,Sports,Nike Women Pink Polo T-shirt
2302,Women,Apparel,Topwear,Tshirts,White,2010,Sports,Nike Women Icon SS White T-shirt
2303,Women,Apparel,Topwear,Tshirts,Pink,2010,Sports,Nike Women Icon SS Pink T-shirt
2305,Women,Apparel,Topwear,Tshirts,Blue,2010,Sports,Nike Women Blue Polo T-shirt
2307,Women,Apparel,Topwear,Tshirts,Purple,2010,Sports,Nike Women Purple Polo T-shirt
2309,Women,Apparel,Topwear,Tshirts,Blue,2010,Sports,Nike Women Miller Blue T-shirt
2311,Women,Apparel,Topwear,Tshirts,Pink,2010,Sports,Nike Womens Pink T-shirt
2313,Women,Apparel,Topwear,Tshirts,White,2010,Sports,Nike Womens Green Polo T-shirt
2315,Women,Apparel,Topwear,Tshirts,Pink,2010,Sports,Nike Womens Cruiser Pink T-shirt
2322,Women,Apparel,Topwear,Tshirts,White,2010,Sports,Nike Womens Luck White T-shirt
2484,Women,Apparel,Topwear,Tshirts,White,2010,Sports,Puma Women Spagetti White Top
2485,Women,Apparel,Topwear,Tshirts,Purple,2010,Sports,Puma Women Purple Blouson Top
2586,Women,Apparel,Topwear,Tshirts,Pink,2010,Casual,Quechua Women Pink T-shirt
2602,Women,Apparel,Topwear,Tshirts,Purple,2010,Sports,ADIDAS Women Fiesta Purple T-shirt
2604,Women,Apparel,Topwear,Tshirts,Maroon,2010,Sports,ADIDAS Women Maroon T-shirt
2605,Women,Apparel,Topwear,Tshirts,White,2010,Sports,ADIDAS Women's Icon White T-shirt
2920,Women,Apparel,Topwear,Tshirts,Blue,2010,Casual,DUSG Women's Green Polo T-shirt
2921,Women,Apparel,Topwear,Tshirts,Multi,2010,Casual,DUSG Women's Brown Polo T-shirt
2936,Women,Apparel,Topwear,Tshirts,Maroon,2010,Casual,DUSG Women's Red Polo T-shirt
2937,Women,Apparel,Topwear,Tshirts,Peach,2010,Casual,DUSG Women's Mother & Child Bamboo Sand T-shirt
2939,Women,Apparel,Topwear,Tshirts,Blue,2010,Casual,DUSG Women's Play Lady Organic Blue T-shirt
2974,Women,Apparel,Topwear,Tshirts,Green,2010,Casual,Puma Women's Heroes Green T-shirt
2976,Women,Apparel,Topwear,Tshirts,Purple,2010,Casual,Puma Women's Lifestyle Purple Polo T-shirt
2978,Women,Apparel,Topwear,Tshirts,Pink,2010,Casual,Puma Women's Punk Graphic Pink T-shirt
2983,Women,Apparel,Topwear,Tshirts,Grey,2010,Casual,Puma Women's Graphic V-Neck Grey T-shirt
3495,Women,Apparel,Topwear,Tshirts,White,2010,Sports,ADIDAS Women Fresh Graphic White T-shirt
3502,Women,Apparel,Topwear,Tshirts,Black,2010,Sports,ADIDAS Women's Black T-shirt
4098,Women,Apparel,Topwear,Tshirts,White,2010,Sports,Nike Women's White Polo T-shirt
59407,Women,Apparel,Topwear,Tshirts,Grey,2010,Casual,Tokyo Talkies Women Grey T-shirt
59418,Women,Apparel,Topwear,Tshirts,Orange,2010,Casual,Tokyo Talkies Women Orange T-shirt
2697,Girls,Apparel,Dress,Dresses,Blue,2011,Casual,Disney Kids Girl's Blue Pooh Kidswear
2699,Girls,Apparel,Dress,Dresses,Pink,2011,Casual,Disney Kids Girls Disney girl pink pooh top Kidswear
2704,Girls,Apparel,Dress,Dresses,White,2011,Casual,Disney Kids Girl's White Pooh Kidswear
2705,Girls,Apparel,Dress,Dresses,Blue,2011,Casual,Disney Kids Girl's Blue Pooh Blouse Kidswear
2707,Girls,Apparel,Dress,Dresses,Pink,2011,Casual,Disney Kids Girl's Dress Pink Pooh Kidswear
2708,Girls,Apparel,Dress,Dresses,White,2011,Casual,Disney Kids Girl's White Dress Pooh Kidswear
2710,Girls,Apparel,Dress,Dresses,White,2011,Casual,Disney Kids Girl's White Daisy Kidswear
2711,Girls,Apparel,Dress,Dresses,Pink,2011,Casual,Disney Kids Girl's Halter Neck Pink Kidswear
2712,Girls,Apparel,Dress,Dresses,Blue,2011,Casual,Disney Kids Girl's Halter Neck Blue Kidswear
5570,Girls,Apparel,Dress,Dresses,Grey,2011,Casual,Ant Kids Girl's Sleeveless With Flower Print Kidswear
12849,Girls,Apparel,Dress,Dresses,White,2011,Casual,Ant Kids Girls Butterfly Print White Dresses
16804,Girls,Apparel,Dress,Dresses,White,2011,Casual,ANT Kids Girls Printed White Dress
18166,Girls,Apparel,Dress,Dresses,Magenta,2011,Casual,Doodle Kids Girls Party Frock Purple Dress
18167,Girls,Apparel,Dress,Dresses,Magenta,2011,Casual,Doodle Kids Girls Party Frock Purple Dress
18168,Girls,Apparel,Dress,Dresses,Pink,2011,Casual,Doodle Kids Girls Party Frock Pink Dress
18169,Girls,Apparel,Dress,Dresses,Pink,2011,Casual,Doodle Kids Girls Party Frock Pink Dress
18174,Girls,Apparel,Dress,Dresses,Lavender,2011,Casual,Doodle Kids Girls Party Frock Lavender Dress
18175,Girls,Apparel,Dress,Dresses,Lavender,2011,Casual,Doodle Kids Girls Party Frock Lavender Dress
23621,Girls,Apparel,Dress,Dresses,Navy Blue,2011,Casual,Doodle Kids Girls Navy Blue Floral Print Dress
25503,Girls,Apparel,Dress,Dresses,Black,2011,Casual,Doodle Kids Girls Polka Dot Black Dress
17618,Girls,Apparel,Bottomwear,Leggings,Black,2011,Casual,Doodle Girls Lace Bow Black Leggings
17619,Girls,Apparel,Bottomwear,Leggings,White,2011,Casual,Doodle Girls Lace Bow White Leggings
17620,Girls,Apparel,Bottomwear,Leggings,Red,2011,Casual,Doodle Girls Red Leggings
17621,Girls,Apparel,Bottomwear,Leggings,Pink,2011,Casual,Doodle Girls Lace Bow LT.Pink Leggings
2702,Girls,Apparel,Topwear,Shirts,Blue,2011,Casual,Disney Kids Girl's Blue Check Kidswear Shirt
13258,Girls,Apparel,Bottomwear,Shorts,Purple,2011,Casual,Gini and Jony Girls Purple Shorts
16803,Girls,Apparel,Bottomwear,Shorts,Beige,2011,Casual,ANT Kids Girls Solid Beige Short
16806,Girls,Apparel,Bottomwear,Shorts,White,2011,Casual,ANT Kids Girls Solid White Short
3896,Girls,Apparel,Bottomwear,Skirts,Blue,2011,Casual,Disney Kids Girl's Denim Minnie Dark Blue Skirt
3901,Girls,Apparel,Bottomwear,Skirts,Blue,2011,Casual,Disney Kids Girl's Pooh Denim Blue Skirt
5575,Girls,Apparel,Bottomwear,Skirts,Green,2011,Casual,Ant Kids Girl's Green Kidswear
5581,Girls,Apparel,Bottomwear,Skirts,Pink,2011,Casual,Ant Kids Girl's Flower Print Frill Pink Kidswear
5586,Girls,Apparel,Bottomwear,Skirts,Brown,2011,Casual,Ant Kids Girl's Tiger Print Kidswear
16805,Girls,Apparel,Bottomwear,Skirts,Black,2011,Casual,ANT Kids Girls Printed Black Skirt
2700,Girls,Apparel,Topwear,Tops,White,2011,Casual,Disney Kids Girl's White Kidswear
2701,Girls,Apparel,Topwear,Tops,Yellow,2011,Casual,Disney Kids Girl's Yellow Daisy Kidswear
2703,Girls,Apparel,Topwear,Tops,Pink,2011,Casual,Disney Kids Girl's Check Pink Kidswear
2706,Girls,Apparel,Topwear,Tops,Pink,2011,Casual,Disney Kids Girl's Pink Pooh Kidswear
2715,Girls,Apparel,Topwear,Tops,Orange,2011,Casual,Disney Kids Girl's Minnie Orange Stripped Kidswear
2716,Girls,Apparel,Topwear,Tops,Red,2011,Casual,Disney Kids Girl's Minnie Red Stripped Kidswear
2717,Girls,Apparel,Topwear,Tops,Blue,2011,Casual,Disney Kids Girls  Kidswear
2718,Girls,Apparel,Topwear,Tops,Red,2011,Casual,Disney Kids Girl's Red Pooh Kidswear
2728,Girls,Apparel,Topwear,Tops,Pink,2011,Casual,Disney Kids Girl's Pink & White Pooh Kidswear
2730,Girls,Apparel,Topwear,Tops,Red,2011,Casual,Disney Kids Girl's Red Round Neck Kidswear
2732,Girls,Apparel,Topwear,Tops,White,2011,Casual,Disney Kids Girl's White Round Neck Kidswear
2737,Girls,Apparel,Topwear,Tops,Red,2011,Casual,Disney Kids Girl's Red Kidswear
2740,Girls,Apparel,Topwear,Tops,Blue,2011,Casual,Disney Kids Girl's Blue Kidswear
2741,Girls,Apparel,Topwear,Tops,Pink,2011,Casual,Disney Kids Girl's Pink Kidswear
2742,Girls,Apparel,Topwear,Tops,White,2011,Casual,Disney Kids Girl's White Minnie & Red Kidswear
2744,Girls,Apparel,Topwear,Tops,Orange,2011,Casual,Disney Kids Girl's Orange Stripe Kidswear
3820,Girls,Apparel,Topwear,Tops,White,2011,Casual,Disney Kids Girl's Minnie Summer Time White Top
4193,Girls,Apparel,Topwear,Tops,Pink,2011,Casual,Disney Kids Girl's Spaghetti Pink Pooh Top Kidswear
5413,Girls,Apparel,Topwear,Tops,Pink,2011,Casual,Ant Kids Girl's Pink White Check Top Kidswear
5414,Girls,Apparel,Topwear,Tops,Purple,2011,Casual,Ant Kids Girl's Purple Top With Sequins Kidswear
5441,Girls,Apparel,Topwear,Tops,Purple,2011,Casual,Ant Kids Girl's Check Top Purple Kidswear
5444,Girls,Apparel,Topwear,Tops,Black,2011,Casual,Ant Kids Girl's Check Top Black Kidswear
8380,Girls,Apparel,Topwear,Tops,Purple,2011,Casual,Doodle Girls Purple Printed Top
10672,Girls,Apparel,Topwear,Tops,Purple,2011,Casual,Doodle Girls Little song board Purple Tops
18171,Girls,Apparel,Topwear,Tops,Green,2011,Casual,Doodle Kids Girls Ballon Green Top
18172,Girls,Apparel,Topwear,Tops,Magenta,2011,Casual,Doodle Kids Girls Magenta Layer Top
18173,Girls,Apparel,Topwear,Tops,Magenta,2011,Casual,Doodle Kids Girls Layer Magenta Top
18178,Girls,Apparel,Topwear,Tops,Black,2011,Casual,Doodle Kids Girls Black Layer Top
18179,Girls,Apparel,Topwear,Tops,Black,2011,Casual,Doodle Kids Girls Black Layer Top
21863,Girls,Apparel,Topwear,Tops,Yellow,2011,Casual,Chhota Bheem Kids Girls Lets Catch Them Yellow Top
21868,Girls,Apparel,Topwear,Tops,Pink,2011,Casual,Chhota Bheem Kids Girls Are You Game Pink Top
23623,Girls,Apparel,Topwear,Tops,Pink,2011,Casual,Doodle Kids Girls Pink I love Shopping Top
23624,Girls,Apparel,Topwear,Tops,White,2011,Casual,Doodle Kids Girls White I love Shopping Top
23625,Girls,Apparel,Topwear,Tops,Pink,2011,Casual,Doodle Kids Girls Pink Retro Top
25520,Girls,Apparel,Topwear,Tops,White,2011,Casual,Doodle Kids Girls City Chic White Top
3819,Girls,Apparel,Topwear,Tshirts,Pink,2011,Casual,Disney Kids Girl's Minnie Summer Time Pink Top
3851,Girls,Apparel,Topwear,Tshirts,Pink,2011,Casual,Disney Kids Girl's Minnie Heart Pink Kidswear
3852,Girls,Apparel,Topwear,Tshirts,Pink,2011,Casual,Disney Kids Girl's Pink Daisy Kidswear
3853,Girls,Apparel,Topwear,Tshirts,Pink,2011,Casual,Disney Kids Girl's Pink Daisy and Squirrel Kidswear
3854,Girls,Apparel,Topwear,Tshirts,Pink,2011,Casual,Disney Kids Girl's Pink Minnie Sunshine Kidswear
3855,Girls,Apparel,Topwear,Tshirts,Red,2011,Casual,Disney Kids Girl's Red Pretty as a Flower Kidswear
3892,Girls,Apparel,Topwear,Tshirts,Pink,2011,Casual,Disney Kids Girl's Pink Minnie Top With Green Bow Kidswear
3893,Girls,Apparel,Topwear,Tshirts,Green,2011,Casual,Disney Kids Girl's Green Minnie Top With Pink Bow Kidswear
3894,Girls,Apparel,Topwear,Tshirts,Pink,2011,Casual,Disney Kids Girl's Pink Minnie With Green Lace Kidswear
3895,Girls,Apparel,Topwear,Tshirts,White,2011,Casual,Disney Kids Girl's White Minnie With Pink Lace Kidswear
3897,Girls,Apparel,Topwear,Tshirts,White,2011,Casual,Disney Kids Girl's Pooh And Hearts White Kidswear
3898,Girls,Apparel,Topwear,Tshirts,Pink,2011,Casual,Disney Kids Girl's Pink Pooh And Tree Kidswear
3899,Girls,Apparel,Topwear,Tshirts,White,2011,Casual,Disney Kids Girl's Pooh And Tree White Kidswear
3902,Girls,Apparel,Topwear,Tshirts,Pink,2011,Casual,Disney Kids Girl's Minnie And Daisy Pink Kidswear
3903,Girls,Apparel,Topwear,Tshirts,Yellow,2011,Casual,Disney Kids Girl's Minnie And Daisy Yellow Kidswear
3904,Girls,Apparel,Topwear,Tshirts,White,2011,Casual,Disney Kids Girl's Red And White Minnie Flower Kidswear
4186,Girls,Apparel,Topwear,Tshirts,Navy Blue,2011,Casual,Disney Kids Girls Navy Stripes Mickey Kidswear
4187,Girls,Apparel,Topwear,Tshirts,Red,2011,Casual,Disney Kids Girls Red Stripes Mickey Kidswear
4212,Girls,Apparel,Topwear,Tshirts,Yellow,2011,Casual,Disney Kids Girl's Yellow Kidswear
4213,Girls,Apparel,Topwear,Tshirts,Pink,2011,Casual,Disney Kids Girl's Pink Summer Fun Fair Kidswear
4214,Girls,Apparel,Topwear,Tshirts,Yellow,2011,Casual,Disney Kids Girl's Yellow Summer Fun Fair Kidswear
4215,Girls,Apparel,Topwear,Tshirts,White,2011,Casual,Disney Kids Girl's White Fun In The Fair Kidswear
4216,Girls,Apparel,Topwear,Tshirts,Yellow,2011,Casual,Disney Kids Girl's Yellow Fun In The Fair Kidswear
4217,Girls,Apparel,Topwear,Tshirts,Blue,2011,Casual,Disney Kids Girl's Blue Disney Jeans Kidswear
4218,Girls,Apparel,Topwear,Tshirts,Purple,2011,Casual,Disney Kids Girl's Purple Disney Jeans Kidswear
4717,Girls,Apparel,Topwear,Tshirts,Pink,2011,Casual,Disney Kids Girl's Summer Fun Fair Pink Teen Kidswear
4718,Girls,Apparel,Topwear,Tshirts,Yellow,2011,Casual,Disney Kids Girl's Summer Fun Fair Yellow Teen Kidswear
4719,Girls,Apparel,Topwear,Tshirts,White,2011,Casual,Disney Kids Girl's Fun In The Fair White Teen Kidswear
4720,Girls,Apparel,Topwear,Tshirts,Yellow,2011,Casual,Disney Kids Girl's Fun In The Fair Yellow Teen Kidswear
4722,Girls,Apparel,Topwear,Tshirts,Purple,2011,Casual,Disney Kids Girl's Jeans Purple Teen Kidswear
4723,Girls,Apparel,Topwear,Tshirts,Blue,2011,Casual,Disney Kids Girl's Jeans Blue Teen Kidswear
4724,Girls,Apparel,Topwear,Tshirts,Yellow,2011,Casual,Disney Kids Girl's Yellow Teen Kidswear
5215,Girls,Apparel,Topwear,Tshirts,White,2011,Casual,Disney Kids Girl's Pink White Sweet Hunny Pack of 2 Kidswear
5415,Girls,Apparel,Topwear,Tshirts,Red,2011,Casual,Ant Kids Girl's Red Little Heart Kidswear
5416,Girls,Apparel,Topwear,Tshirts,White,2011,Casual,Ant Kids Girl's White Little Heart Kidswear
5417,Girls,Apparel,Topwear,Tshirts,Blue,2011,Casual,Ant Kids Girls Blue T-shirt
5418,Girls,Apparel,Topwear,Tshirts,Pink,2011,Casual,Ant Kids Girl's Pink Free Bird Kidswear
5428,Girls,Apparel,Topwear,Tshirts,White,2011,Casual,Ant Kids Girl's White Free Bird Kidswear
5438,Girls,Apparel,Topwear,Tshirts,Blue,2011,Casual,Ant Kids Girl's Humming Birds Blue Kidswear
8358,Girls,Apparel,Topwear,Tshirts,Blue,2011,Casual,Doodle Girl's Princess Cute Little Light Blue Kidswear
8359,Girls,Apparel,Topwear,Tshirts,Pink,2011,Casual,Doodle Girl's Princess Cute Little Pink Kidswear
8360,Girls,Apparel,Topwear,Tshirts,Yellow,2011,Casual,Doodle Girl's Tonight Night Rock Yellow Pink Kidswear
8361,Girls,Apparel,Topwear,Tshirts,Green,2011,Casual,Doodle Girl's Tonight Night Rock Light Green Kidswear
8364,Girls,Apparel,Topwear,Tshirts,Blue,2011,Casual,Doodle Girl's Happy Smiles Blue Pink Kidswear
8365,Girls,Apparel,Topwear,Tshirts,Pink,2011,Casual,Doodle Girl's Happy Smiles Pink Kidswear
8366,Girls,Apparel,Topwear,Tshirts,Green,2011,Casual,Doodle Girl's I Love My Bicycle Green Kidswear
8367,Girls,Apparel,Topwear,Tshirts,Pink,2011,Casual,Doodle Girl's I Love My Bicycle Pink Kidswear
8368,Girls,Apparel,Topwear,Tshirts,Pink,2011,Casual,Doodle Girl's Halter Neck Pink Kidswear
8369,Girls,Apparel,Topwear,Tshirts,Purple,2011,Casual,Doodle Girl's Purple Halter Neck Purple Kidswear
8371,Girls,Apparel,Topwear,Tshirts,Yellow,2011,Casual,Doodle Girl's Dont Worry Hippie Yellow Teen Kidswear
8372,Girls,Apparel,Topwear,Tshirts,Blue,2011,Casual,Doodle Girl's Dont Worry Hippie Teal Blue Kidswear
8375,Girls,Apparel,Topwear,Tshirts,Blue,2011,Casual,Doodle Girl's Dont Worry Hippie Blue Teen Kidswear
8378,Girls,Apparel,Topwear,Tshirts,Green,2011,Casual,Doodle Girl's Princess Lime Kidswear
8379,Girls,Apparel,Topwear,Tshirts,Green,2011,Casual,Doodle Girl's Princess Lime Green Top
8381,Girls,Apparel,Topwear,Tshirts,Purple,2011,Casual,Doodle Girl's Raw Edges Purple Teen Kidswear
8382,Girls,Apparel,Topwear,Tshirts,Blue,2011,Casual,Doodle Girl's Raw Edges Light Blue Kidswear
8383,Girls,Apparel,Topwear,Tshirts,Blue,2011,Casual,Doodle Girl's Raw Edges Light Blue Teen Kidswear
8384,Girls,Apparel,Topwear,Tshirts,Orange,2011,Casual,Doodle Girl's Hippie Chic Orange Kidswear
8385,Girls,Apparel,Topwear,Tshirts,Orange,2011,Casual,Doodle Girl's Hippie Chic Orange Teen Kidswear
8414,Girls,Apparel,Topwear,Tshirts,White,2011,Casual,Doodle Girl's Hippie Chic White Kidswear
8415,Girls,Apparel,Topwear,Tshirts,White,2011,Casual,Doodle Girl's Hippie Chic White Teen Kidswear
8417,Girls,Apparel,Topwear,Tshirts,Yellow,2011,Casual,Doodle Girl's Saturday 24Am Yellow Teen Kidswear
8418,Girls,Apparel,Topwear,Tshirts,Blue,2011,Casual,Doodle Girl's Crazy Funny Blue Kidswear
8419,Girls,Apparel,Topwear,Tshirts,Blue,2011,Casual,Doodle Girl's Crazy Funny Blue Teen Kidswear
8420,Girls,Apparel,Topwear,Tshirts,Pink,2011,Casual,Doodle Girl's Crazy And Funny Pink Kidswear
8465,Girls,Apparel,Topwear,Tshirts,Purple,2011,Casual,Doodle Girls's Princess Purple Teen Top
9927,Girls,Apparel,Topwear,Tshirts,Orange,2011,Casual,Doodle Girls Saturday 24Am Orange Tshirts
17609,Girls,Apparel,Topwear,Tshirts,White,2011,Casual,Doodle Girls Raindrops White Tshirts
17612,Girls,Apparel,Topwear,Tshirts,Grey,2011,Casual,Doodle Cute Girls  Grey Tshirt
21853,Girls,Apparel,Topwear,Tshirts,Orange,2011,Casual,Chhota Bheem Kids Girls Sea Princess Light Orange T-shirt
