id,gender,masterCategory,subCategory,articleType,baseColour,year,usage,productDisplayName
7311,Women,Apparel,Topwear,Tops,Grey,2011,Casual,UCB Women Stripe Sleeveless Grey Orange Top
7312,Women,Apparel,Topwear,Tops,Pink,2011,Casual,UCB Women's Short Sleeve Polo Pink Top
7313,Women,Apparel,Topwear,Tops,White,2011,Casual,UCB Women Sleeveless White Top
7314,Women,Apparel,Topwear,Tops,Green,2011,Casual,UCB Women's Racer Back Green Top
7315,Women,Apparel,Topwear,Tops,White,2011,Ethnic,UCB Women Sleeveless Cowl Neck White Top
7316,Women,Apparel,Topwear,Tops,Blue,2011,Casual,UCB Women's Sleeveless Cowl Neck Blue Top
7317,Women,Apparel,Topwear,Tops,Pink,2011,Casual,UCB Women Quarter Sleeve Round Neck Pink Top
7362,Women,Apparel,Topwear,Tops,Blue,2011,Casual,UCB Women's Graphic Print Sequins Blue Top
7422,Women,Apparel,Topwear,Tops,White,2011,Ethnic,W Women Mandarin Neck Full Sleeve White Top
7425,Women,Apparel,Topwear,Tops,Black,2011,Ethnic,W Women's Deep U Neck Sleeveless White Black Top
7426,Women,Apparel,Topwear,Tops,Purple,2011,Casual,W Women Mandarin Neck Sleeveless Purple Top
7427,Women,Apparel,Topwear,Tops,Black,2011,Casual,W Women's Deep U Neck Short Sleeve Black Top
7428,Women,Apparel,Topwear,Tops,Red,2011,Ethnic,W Women V Neck Kaftan Sleeve Red Top
7697,Women,Apparel,Topwear,Tops,Grey,2011,Casual,Jealous 21 Women Chic Melange Grey Top
7698,Women,Apparel,Topwear,Tops,Purple,2011,Casual,Jealous 21 Women's She's Got Attitude Purple Top
7699,Women,Apparel,Topwear,Tops,Purple,2011,Casual,Jealous 21 Women Frills Florals Aubergine Purple Top
7700,Women,Apparel,Topwear,Tops,Pink,2011,Casual,Jealous 21 Women's All Girls Dying Jealousy Pink Top
7702,Women,Apparel,Topwear,Tops,Green,2011,Casual,Jealous 21 Women's She's Got Attitude Mint Green Tops
7703,Women,Apparel,Topwear,Tops,Black,2011,Casual,Jealous 21 Women Neckline Black Top
7704,Women,Apparel,Topwear,Tops,Red,2011,Casual,Jealous 21 Women's She's Got Attitude Red Top
7705,Women,Apparel,Topwear,Tops,Green,2011,Casual,Jealous 21 Women Did You Year Something Green Top
7706,Women,Apparel,Topwear,Tops,Black,2011,Casual,Jealous 21 Women's She's Got Attitude Black Top
7957,Women,Apparel,Topwear,Tops,Green,2011,Sports,Puma Women's USP Chest Cat Blue Top
8432,Women,Apparel,Topwear,Tops,Purple,2011,Casual,Jealous 21 Women Jealous Frills and florals Purple Top Purple Tops
8433,Women,Apparel,Topwear,Tops,Brown,2011,Casual,Jealous 21 Women Jealous Ebony Brown Top Brown Tops
8435,Women,Apparel,Topwear,Tops,Purple,2011,Casual,Jealous 21 Women Edie Purple Top
8436,Women,Apparel,Topwear,Tops,Pink,2011,Casual,Jealous 21 Women Jealous Gaius Pink Top Pink Tops
8437,Women,Apparel,Topwear,Tops,Grey,2011,Casual,Jealous 21 Women Jealous Gale Coral Top Grey Tops
8438,Women,Apparel,Topwear,Tops,Yellow,2011,Casual,Jealous 21 Women Jealous Mabon Yellow Top Yellow Tops
8439,Women,Apparel,Topwear,Tops,Purple,2011,Casual,Jealous 21 Women Jealous Macrae Purple Top
8441,Women,Apparel,Topwear,Tops,Blue,2011,Casual,Jealous 21 Women Jealous Ece Blue Top Blue Tops
8442,Women,Apparel,Topwear,Tops,Grey,2011,Casual,Jealous 21 Women Jealous Edna Grey Top Grey Tops
8445,Women,Apparel,Topwear,Tops,Blue,2011,Casual,Jealous 21 Women Jealous Edana Teal Top Blue Tops
8446,Women,Apparel,Topwear,Tops,Grey,2011,Casual,Jealous 21 Women Jealous Pam Grey Top Grey Tops
8447,Women,Apparel,Topwear,Tops,Navy Blue,2011,Casual,Jealous 21 Women Jealous Palila Purple Top Purple Tops
8448,Women,Apparel,Topwear,Tops,Grey,2011,Casual,Jealous 21 Women about my style Purple Top
8449,Women,Apparel,Topwear,Tops,Black,2011,Casual,Jealous 21 Women Jealous Panthea Purple Top Black Tops
8450,Women,Apparel,Topwear,Tops,Peach,2011,Casual,Jealous 21 Women Jealous Paris Black Top Black Tops
8451,Women,Apparel,Topwear,Tops,Yellow,2011,Casual,Jealous 21 Women Printed Rach Yellow Top
8452,Women,Apparel,Topwear,Tops,Blue,2011,Casual,Jealous 21 Women Jealous Rain Blue Top Blue Tops
8453,Women,Apparel,Topwear,Tops,Black,2011,Casual,Jealous 21 Women Jealous Randa Black Top Black Tops
8454,Women,Apparel,Topwear,Tops,White,2011,Casual,Jealous 21 Women Jealous Ranae White Top White Tops
8455,Women,Apparel,Topwear,Tops,Pink,2011,Casual,Jealous 21 Women Jealous Ran Pink Top Pink Tops
8456,Women,Apparel,Topwear,Tops,Green,2011,Casual,Jealous 21 Women Jealous Rae Green Top Green Tops
8457,Women,Apparel,Topwear,Tops,Pink,2011,Casual,Jealous 21 Women jealous Surf Island Forever Pink top Pink Tops
8458,Women,Apparel,Topwear,Tops,Pink,2011,Casual,Jealous 21 Women  Printed Pink Top
8459,Women,Apparel,Topwear,Tops,Green,2011,Casual,Jealous 21 Women Jelaous Cais Green Top Green Tops
8460,Women,Apparel,Topwear,Tops,Pink,2011,Casual,Jealous 21 Women Jealous Calandra Pink Top Pink Tops
8461,Women,Apparel,Topwear,Tops,Pink,2011,Casual,Jealous 21 Women Jealous Caley Pink Top Pink Tops
8462,Women,Apparel,Topwear,Tops,White,2011,Casual,Jealous 21 Women Jealous Cailyn White Top White Tops
8463,Women,Apparel,Topwear,Tops,Pink,2011,Casual,Jealous 21 Women Jealous Paiva Pink Tops
8466,Women,Apparel,Topwear,Tops,Blue,2011,Casual,Scullers For Her Women Light Work Blue Tops
8475,Women,Apparel,Topwear,Tops,Purple,2011,Casual,Scullers For Her Women Check Purple Top
8476,Women,Apparel,Topwear,Tops,Pink,2011,Casual,Scullers For Her Women Pink Check Top Pink Tops
8488,Women,Apparel,Topwear,Tops,Grey,2011,Casual,Forever New Women Slate Grey Tops
8489,Women,Apparel,Topwear,Tops,Beige,2011,Casual,Forever New Women Shell Beige Tops
8490,Women,Apparel,Topwear,Tops,White,2011,Casual,Forever New Women White Lace  Top
8491,Women,Apparel,Topwear,Tops,White,2011,Casual,Forever New Women Porcelain White Top
8492,Women,Apparel,Topwear,Tops,Peach,2011,Casual,Forever New Women Peony Peach Top
8764,Women,Apparel,Topwear,Tops,Blue,2011,Casual,s.Oliver Women's Blue Tops
9106,Women,Apparel,Topwear,Tops,Black,2011,Casual,Forever New Women Brown Top
9151,Women,Apparel,Topwear,Tops,Grey,2011,Casual,Jealous 21 Women Checks Grey Tops
9153,Women,Apparel,Topwear,Tops,Purple,2011,Casual,Jealous 21 Women Jealous Purple Tops
9154,Women,Apparel,Topwear,Tops,Grey,2011,Casual,Jealous 21 Women Checks Grey Tops
9155,Women,Apparel,Topwear,Tops,Black,2011,Casual,Jealous 21 Women Jealous Black Tops
9156,Women,Apparel,Topwear,Tops,Purple,2011,Casual,Jealous 21 Women Lavender Purple Tops
9332,Women,Apparel,Topwear,Tops,White,2011,Casual,Puma Women Ess Striped White Tops
9333,Women,Apparel,Topwear,Tops,White,2011,Casual,Puma Women Edition White Tops
9334,Women,Apparel,Topwear,Tops,Black,2011,Casual,Puma Women Heroes Graphic Black Tops
9340,Women,Apparel,Topwear,Tops,Black,2011,Casual,Puma Women blink blink Black Tops
9799,Women,Apparel,Topwear,Tops,Magenta,2011,Casual,Scullers For Her Women Scullers Top Magenta Tops
9801,Women,Apparel,Topwear,Tops,Purple,2011,Casual,Scullers For Her Women Scullers Top Purple Tops
9802,Women,Apparel,Topwear,Tops,Navy Blue,2011,Casual,Scullers For Her Women Scullers Top Navy Blue Tops
9996,Women,Apparel,Topwear,Tops,Blue,2011,Casual,Palm Tree Girls Sp Jelly Top Blue Tops
9997,Women,Apparel,Topwear,Tops,Blue,2011,Casual,Palm Tree Girls Hs Livia Top Blue Tops
9998,Women,Apparel,Topwear,Tops,Pink,2011,Casual,Palm Tree Girls Hs Livia Top Pink Tops
9999,Women,Apparel,Topwear,Tops,Blue,2011,Casual,Palm Tree Kids Girl Mm Merlin Top Blue Tops
10324,Women,Apparel,Topwear,Tops,Black,2011,Casual,Puma Women Heather USP Black Tshirts
10335,Women,Apparel,Topwear,Tops,Pink,2011,Casual,United Colors of Benetton Women Striped Magenta Top
10336,Women,Apparel,Topwear,Tops,Black,2011,Casual,United Colors of Benetton Women Stripes Black Tops
10342,Women,Apparel,Topwear,Tops,Black,2011,Casual,United Colors of Benetton Women Printed Tunic Black Tops
10354,Women,Apparel,Topwear,Tops,Blue,2011,Casual,United Colors of Benetton Women Checks Blue Tops
10363,Women,Apparel,Topwear,Tops,Grey,2011,Casual,United Colors of Benetton Women Solid Grey Tops
10382,Women,Apparel,Topwear,Tops,Grey,2011,Casual,United Colors of Benetton Women Grey Top
10401,Women,Apparel,Topwear,Tops,Purple,2011,Casual,Jealous 21 Women Uaine Purple Tops
10402,Women,Apparel,Topwear,Tops,Pink,2011,Casual,Jealous 21 Women Una Pink Tops
10403,Women,Apparel,Topwear,Tops,Purple,2011,Casual,Jealous 21 Women Uri Purple Tops
10405,Women,Apparel,Topwear,Tops,Black,2011,Casual,United Colors of Benetton Women Top Black Top
10408,Women,Apparel,Topwear,Tops,Black,2011,Casual,United Colors of Benetton Women Solid Black Tops
10415,Women,Apparel,Topwear,Tops,Beige,2011,Casual,United Colors of Benetton Women Printed Beige Tops
10418,Women,Apparel,Topwear,Tops,Black,2011,Casual,United Colors of Benetton Women Solid Black Tops
10428,Women,Apparel,Topwear,Tops,Black,2011,Casual,United Colors of Benetton Women Solid Black Tops
10429,Women,Apparel,Topwear,Tops,Black,2011,Casual,United Colors of Benetton Women Solid Black Top
10498,Women,Apparel,Topwear,Tops,Navy Blue,2011,Casual,Flying Machine Women RN Blue Tops
10506,Women,Apparel,Topwear,Tops,Red,2011,Casual,Flying Machine Women Fuschia Red Tshirts
10508,Women,Apparel,Topwear,Tops,Black,2011,Casual,Flying Machine Women RN SL Black Top
10511,Women,Apparel,Topwear,Tops,Black,2011,Casual,Flying Machine Women RN Black Tshirts
10512,Women,Apparel,Topwear,Tops,Blue,2011,Casual,Flying Machine Women RN HS Blue Tshirts
10514,Women,Apparel,Topwear,Tops,Pink,2011,Casual,Flying Machine Women RN SL Pink Tshirts
10569,Women,Apparel,Topwear,Tops,White,2011,Casual,Puma Women Ess White Polo Tshirts
10647,Women,Apparel,Topwear,Tops,Pink,2011,Casual,Doodle Girl Little Princess Pink Tops
10656,Women,Apparel,Topwear,Tops,Pink,2011,Casual,Doodle Girl Little frock Pink Tops
10658,Women,Apparel,Topwear,Tops,White,2011,Casual,Doodle Girl Little frock White Tops
10673,Women,Apparel,Topwear,Tops,Black,2011,Casual,Doodle Girl Ballet School Black Tops
10674,Women,Apparel,Topwear,Tops,White,2011,Casual,Doodle Girl Princess White Tops
10675,Women,Apparel,Topwear,Tops,Black,2011,Casual,Doodle Girl Princess Black Tops
10676,Women,Apparel,Topwear,Tops,Red,2011,Casual,Doodle Girl Bubbles Red Tops
10677,Women,Apparel,Topwear,Tops,Pink,2011,Casual,Doodle Girl Flap doodle angel Pink Tops
10678,Women,Apparel,Topwear,Tops,White,2011,Casual,Doodle Girl Super stylish White Tops
10685,Women,Apparel,Topwear,Tops,White,2011,Casual,Doodle Girl Little Princess White Tops
10693,Women,Apparel,Topwear,Tops,Purple,2011,Casual,Doodle Girl Cute Purple Tops
10694,Women,Apparel,Topwear,Tops,Pink,2011,Casual,Doodle Girl Be Born Pink Tops
10715,Women,Apparel,Topwear,Tops,Black,2011,Casual,Nike Women Training sports bra Black Tops
10717,Women,Apparel,Topwear,Tops,Purple,2011,Sports,Nike Women Trainng sports bra Purple Tops
10718,Women,Apparel,Topwear,Tops,Orange,2011,Sports,Nike Women Trainng sports bra Orange Tops
11010,Women,Apparel,Topwear,Tops,Purple,2011,Casual,Wrangler Women Smocked Yoke Purple Tops
11011,Women,Apparel,Topwear,Tops,Blue,2011,Casual,Wrangler Women Smocked Yoke Blue Tops
11012,Women,Apparel,Topwear,Tops,Multi,2011,Casual,Wrangler Women Frill Check Multi Tops
11013,Women,Apparel,Topwear,Tops,Multi,2011,Casual,Wrangler Women Frill Check Multi Tops
11016,Women,Apparel,Topwear,Tops,Pink,2011,Casual,Wrangler Women Floral Print Pink Top
11017,Women,Apparel,Topwear,Tops,Blue,2011,Casual,Wrangler Women Floral Print Blue Top
11026,Women,Apparel,Topwear,Tops,Navy Blue,2011,Casual,Wrangler Women Navy Blue Top
11029,Women,Apparel,Topwear,Tops,Purple,2011,Casual,Jealous 21 Women Check Purple Tops
11031,Women,Apparel,Topwear,Tops,Blue,2011,Casual,Jealous 21 Women Check Blue Tops
11033,Women,Apparel,Topwear,Tops,Red,2011,Casual,Jealous 21 Women Check Red Tops
11034,Women,Apparel,Topwear,Tops,Red,2011,Casual,Jealous 21 Women Check Red Tops
11036,Women,Apparel,Topwear,Tops,Black,2011,Casual,Jealous 21 Women Solid Black Tops
11037,Women,Apparel,Topwear,Tops,Pink,2011,Casual,Jealous 21 Women Solid Pink Tops
11038,Women,Apparel,Topwear,Tops,Brown,2011,Casual,Jealous 21 Women Check Brown Tops
11097,Women,Apparel,Topwear,Tops,Black,2011,Casual,Scullers Women Solid Black Tops
11130,Women,Apparel,Topwear,Tops,Purple,2011,Casual,Scullers Women Solid Purple Tops
11258,Women,Apparel,Topwear,Tops,Black,2011,Sports,Puma Women Black Essential Racerback Tank Top
11338,Women,Apparel,Topwear,Tops,Black,2011,Casual,United Colors of Benetton Women Solid Black Tops
11355,Women,Apparel,Topwear,Tops,Black,2011,Casual,United Colors Of Benetton Women Light Winter Black Tops
11358,Women,Apparel,Topwear,Tops,Purple,2011,Casual,United Colors Of Benetton Women Light Winter Purple Tops
11360,Women,Apparel,Topwear,Tops,White,2011,Casual,United Colors Of Benetton Women Light Winter White Tops
11361,Women,Apparel,Topwear,Tops,Pink,2011,Casual,United Colors Of Benetton Women Winter Pink Top
11362,Women,Apparel,Topwear,Tops,Beige,2011,Casual,United Colors of Benetton Women  Printed Beige Top
11364,Women,Apparel,Topwear,Tops,Magenta,2011,Casual,United Colors of Benetton Women Magenta Top
11365,Women,Apparel,Topwear,Tops,Black,2011,Casual,United Colors Of Benetton Women Light Winter Black Tops
11366,Women,Apparel,Topwear,Tops,Purple,2011,Casual,United Colors of Benetton Women  Light Purple Printed Top
11367,Women,Apparel,Topwear,Tops,Purple,2011,Casual,United Colors Of Benetton Women Light Winter Purple Tops
11369,Women,Apparel,Topwear,Tops,Pink,2011,Casual,United Colors Of Benetton Women Light Winter Pink Tops
11373,Women,Apparel,Topwear,Tops,Pink,2011,Casual,United Colors Of Benetton Women Light Winter Pink Tops
11374,Women,Apparel,Topwear,Tops,Red,2011,Casual,United Colors Of Benetton Women Light Winter Red Tops
11376,Women,Apparel,Topwear,Tops,Grey,2011,Casual,United Colors Of Benetton Women Light Winter Grey Tops
11379,Women,Apparel,Topwear,Tops,Blue,2011,Casual,United Colors Of Benetton Women Winter Blue Top
11380,Women,Apparel,Topwear,Tops,Black,2011,Casual,United Colors Of Benetton Women Light Winter Black Tops
11381,Women,Apparel,Topwear,Tops,Multi,2011,Casual,United Colors of Benetton Women Multi Coloured Top
11383,Women,Apparel,Topwear,Tops,Black,2011,Casual,United Colors Of Benetton Women Light Winter Black Tops
11403,Women,Apparel,Topwear,Tops,Red,2011,Casual,United Colors of Benetton Women Light Winter Red Tops
11415,Women,Apparel,Topwear,Tops,Brown,2011,Casual,United Colors of Benetton Women Light Winter Brown Top
11427,Women,Apparel,Topwear,Tops,Purple,2011,Casual,United Colors of Benetton Women Light Winter Purple Tops
11428,Women,Apparel,Topwear,Tops,Black,2011,Casual,United Colors of Benetton Women  Winter Black Animal Print Top
11429,Women,Apparel,Topwear,Tops,Black,2011,Casual,United Colors of Benetton Women Black Light Winter Top
11432,Women,Apparel,Topwear,Tops,Purple,2011,Casual,United Colors of Benetton Women Winter Purple Top
11434,Women,Apparel,Topwear,Tops,Grey,2011,Casual,United Colors of Benetton Women Light Winter Grey Tops
11435,Women,Apparel,Topwear,Tops,White,2011,Casual,United Colors of Benetton Women Light Winter White Tops
11437,Women,Apparel,Topwear,Tops,Purple,2011,Casual,United Colors of Benetton Women Light Winter Purple Tops
11438,Women,Apparel,Topwear,Tops,Black,2011,Casual,United Colors of Benetton Women  Winter Black Top
11439,Women,Apparel,Topwear,Tops,Navy Blue,2011,Casual,United Colors of Benetton Women Solid Navy Blue Top
11440,Women,Apparel,Topwear,Tops,White,2011,Casual,United Colors of Benetton Women Light Winter White Top
11442,Women,Apparel,Topwear,Tops,Purple,2011,Casual,United Colors of Benetton Women Light Winter Purple Tops
11443,Women,Apparel,Topwear,Tops,Pink,2011,Casual,United Colors of Benetton Women Light Winter Pink Tops
11445,Women,Apparel,Topwear,Tops,White,2011,Casual,United Colors of Benetton Women  Winter White Printed Top
11446,Women,Apparel,Topwear,Tops,White,2011,Casual,United Colors of Benetton Women White Light Winter Top
11448,Women,Apparel,Topwear,Tops,Pink,2011,Casual,United Colors of Benetton Women Light Winter Pink Tops
11449,Women,Apparel,Topwear,Tops,Blue,2011,Casual,United Colors of Benetton Women Light Winter Blue Tops
11471,Women,Apparel,Topwear,Tops,Brown,2011,Casual,United Colors of Benetton Women Light Winter Brown Tops
11472,Women,Apparel,Topwear,Tops,Blue,2011,Casual,United Colors of Benetton Women Blue Winter Printed Top
11479,Women,Apparel,Topwear,Tops,Purple,2011,Casual,United Colors of Benetton Women Light Winter Purple Tops
11480,Women,Apparel,Topwear,Tops,Grey,2011,Casual,United Colors of Benetton Women Light Winter Grey Top
11481,Women,Apparel,Topwear,Tops,Green,2011,Casual,United Colors of Benetton Women Light Winter Green Tops
11525,Women,Apparel,Topwear,Tops,White,2011,Casual,United Colors of Benetton Women White Top
11526,Women,Apparel,Topwear,Tops,Black,2011,Casual,United Colors of Benetton Women Light Winter Black Tops
11532,Women,Apparel,Topwear,Tops,Black,2011,Casual,United Colors of Benetton Women Light Winter Black Tops
11753,Women,Apparel,Topwear,Tops,Pink,2011,Casual,Lee Women Printed Pink Top
11755,Women,Apparel,Topwear,Tops,White,2011,Casual,Lee Women Solid White Shirts
11756,Women,Apparel,Topwear,Tops,White,2011,Casual,Lee Women Solid White Tops
11757,Women,Apparel,Topwear,Tops,Purple,2011,Casual,Lee Women Solid Purple Tops
11758,Women,Apparel,Topwear,Tops,White,2011,Casual,Lee Women Solid White Tops
11759,Women,Apparel,Topwear,Tops,Grey,2011,Casual,Lee Women Solid Grey Tops
11761,Women,Apparel,Topwear,Tops,Green,2011,Casual,Lee Women Solid Green Tshirts
12494,Women,Apparel,Topwear,Tops,Grey,2011,Casual,United Colors of Benetton Women Short Grey Tops
12504,Women,Apparel,Topwear,Tops,Purple,2011,Casual,United Colors of Benetton Women Short Purple Tops
12505,Women,Apparel,Topwear,Tops,Black,2011,Casual,United Colors of Benetton Women Short Black Tops
12604,Women,Apparel,Topwear,Tops,Purple,2011,Casual,Jealous 21 Women Printed Purple Tops
12605,Women,Apparel,Topwear,Tops,Black,2011,Casual,Jealous 21 Women Stripes Black Tops
12606,Women,Apparel,Topwear,Tops,Cream,2011,Casual,Jealous 21 Women Printed Cream Tops
12607,Women,Apparel,Topwear,Tops,Purple,2011,Casual,Jealous 21 Women Solid Purple Shrug
12608,Women,Apparel,Topwear,Tops,Maroon,2011,Casual,Jealous 21 Women Printed Maroon Tops
12610,Women,Apparel,Topwear,Tops,Purple,2011,Casual,Jealous 21 Women Printed Purple Tops
12611,Women,Apparel,Topwear,Tops,Green,2011,Casual,Jealous 21 Women Printed Green Tops
12769,Women,Apparel,Topwear,Tops,Red,2011,Ethnic,Mother Earth Women Checks Red Shirts
12770,Women,Apparel,Topwear,Tops,Green,2011,Ethnic,Mother Earth Women Checks Green Shirts
12785,Women,Apparel,Topwear,Tops,Pink,2011,Ethnic,Mother Earth Women Checks Pink Shirts
12831,Women,Apparel,Topwear,Tops,Pink,2011,Casual,Ant Kids Pink Tops
12850,Women,Apparel,Topwear,Tops,Green,2011,Casual,Ant Kids Girl Cheerful Green Tops
12851,Women,Apparel,Topwear,Tops,Black,2011,Casual,Ant Kids Crystal Button Black Tops
13266,Women,Apparel,Topwear,Tops,Maroon,2011,Casual,Palm Tree Kids Girls Printed Maroon Tops
13267,Women,Apparel,Topwear,Tops,Pink,2011,Casual,Palm Tree Kids Girls Printed Pink Tops
13268,Women,Apparel,Topwear,Tops,Pink,2011,Casual,Palm Tree Kids Girls Printed Pink Tops
13269,Women,Apparel,Topwear,Tops,White,2011,Casual,Palm Tree Kids Girls Printed White Tops
13270,Women,Apparel,Topwear,Tops,White,2011,Casual,Palm Tree Kids Girls Printed White Tops
13294,Women,Apparel,Topwear,Tops,Pink,2011,Casual,Gini and Jony Women Printed Pink Tops
13295,Women,Apparel,Topwear,Tops,Pink,2011,Casual,Gini and Jony Kids Girls Printed Pink Tops
13308,Women,Apparel,Topwear,Tops,White,2011,Casual,Gini and Jony Kids Girls Printed White Tops
13309,Women,Apparel,Topwear,Tops,White,2011,Casual,Gini and Jony Kids Girls Printed White Tops
13335,Women,Apparel,Topwear,Tops,Pink,2011,Casual,Gini and Jony Kids Girls Printed Pink Tops
13336,Women,Apparel,Topwear,Tops,Pink,2011,Casual,Gini and Jony Kids Printed Pink Tops
13442,Women,Apparel,Topwear,Tops,White,2011,Casual,United Colors of Benetton Women Solid White Tops
13443,Women,Apparel,Topwear,Tops,White,2011,Casual,United Colors of Benetton Women Solid White Tops
13444,Women,Apparel,Topwear,Tops,Yellow,2011,Casual,United Colors of Benetton Women Printed Yellow Tops
13445,Women,Apparel,Topwear,Tops,White,2011,Casual,United Colors of Benetton Women Printed White Tops
13446,Women,Apparel,Topwear,Tops,Pink,2011,Casual,United Colors of Benetton Women Stripes Pink Tops
13456,Women,Apparel,Topwear,Tops,Pink,2011,Casual,United Colors of Benetton Women Solid Pink Tops
13471,Women,Apparel,Topwear,Tops,Blue,2011,Casual,United Colors of Benetton Women Solid Blue Tunic
13521,Women,Apparel,Topwear,Tops,Grey,2011,Casual,Jealous 21 Women Solid Grey Tops
13522,Women,Apparel,Topwear,Tops,Green,2011,Casual,Jealous 21 Women Solid Green Tops
13523,Women,Apparel,Topwear,Tops,Pink,2011,Casual,Jealous 21 Women Printed Pink Tops
13524,Women,Apparel,Topwear,Tops,Purple,2011,Casual,Jealous 21 Women Solid Purple Tops
13847,Women,Apparel,Topwear,Tops,White,2011,Casual,United Colors of Benetton Women Printed White Top
13890,Women,Apparel,Topwear,Tops,Purple,2011,Casual,Scullers Women Solid Purple Tops
13928,Women,Apparel,Topwear,Tops,Pink,2011,Casual,United Colors of Benetton Women Solid Pink Tops
13946,Women,Apparel,Topwear,Tops,Blue,2011,Casual,United Colors of Benetton Women Solid Blue Tops
13950,Women,Apparel,Topwear,Tops,White,2011,Casual,United Colors of Benetton Women Printed White Tops
13952,Women,Apparel,Topwear,Tops,White,2011,Casual,United Colors of Benetton Women Stripes White Tops
13956,Women,Apparel,Topwear,Tops,White,2011,Casual,United Colors of Benetton Women Solid White Tops
13957,Women,Apparel,Topwear,Tops,Purple,2011,Casual,United Colors of Benetton Women Solid Purple Tops
13958,Women,Apparel,Topwear,Tops,Grey,2011,Casual,United Colors of Benetton Women Solid Grey Tops
13959,Women,Apparel,Topwear,Tops,Grey,2011,Casual,Jealous 21 Women Stripes Grey Tops
13960,Women,Apparel,Topwear,Tops,Grey,2011,Casual,Jealous 21 Women Stripes Grey Tops
13962,Women,Apparel,Topwear,Tops,Pink,2011,Casual,Jealous 21 Women Printed Pink Tops
14095,Women,Apparel,Topwear,Tops,Navy Blue,2011,Casual,Flying Machine Women Solid Navy Blue Tops
14099,Women,Apparel,Topwear,Tops,Pink,2011,Casual,Flying Machine Women Solid Pink Tops
14102,Women,Apparel,Topwear,Tops,Brown,2011,Casual,Flying Machine Women Solid Brown Tops
14107,Women,Apparel,Topwear,Tops,Purple,2011,Casual,Flying Machine Women Solid Purple Tops
14120,Women,Apparel,Topwear,Tops,Grey,2011,Casual,Flying Machine Women Solid Grey Tops
14136,Women,Apparel,Topwear,Tops,Black,2011,Casual,Jealous 21 Women Stripes Black Tops
14200,Women,Apparel,Topwear,Tops,Black,2011,Casual,AND Women Solid Black Tops
14326,Women,Apparel,Topwear,Tops,Black,2011,Casual,ADIDAS Women Printed Black Tops
14583,Women,Apparel,Topwear,Tops,Grey,2011,Casual,United Colors of Benetton Women Solid Grey Tops
14584,Women,Apparel,Topwear,Tops,Red,2011,Casual,United Colors of Benetton Women Solid Red Tops
14585,Women,Apparel,Topwear,Tops,Green,2011,Casual,United Colors of Benetton Women Solid Green Tops
14627,Women,Apparel,Topwear,Tops,Grey,2011,Casual,United Colors of Benetton Women Solid Grey Tops
14633,Women,Apparel,Topwear,Tops,Green,2011,Casual,United Colors of Benetton Women Printed Green Tops
14717,Women,Apparel,Topwear,Tops,Black,2011,Casual,Jealous 21 Women Casual Top Black Tops
14718,Women,Apparel,Topwear,Tops,Navy Blue,2011,Casual,Jealous 21 Women Casual Top Navy Blue Tops
14719,Women,Apparel,Topwear,Tops,Green,2011,Casual,Jealous 21 Women Casual Top Green Tops
14720,Women,Apparel,Topwear,Tops,Purple,2011,Casual,Jealous 21 Women Casual Top Purple Tops
15107,Women,Apparel,Topwear,Tops,Beige,2011,Ethnic,Mother Earth Women Printed Beige Tops
15108,Women,Apparel,Topwear,Tops,Maroon,2011,Ethnic,Mother Earth Women Stripes Maroon Tops
15372,Women,Apparel,Topwear,Tops,Turquoise Blue,2011,Casual,Urban Yoga Women Solid Turquoise Blue Tops
15373,Women,Apparel,Topwear,Tops,Purple,2011,Casual,Urban Yoga Women Solid Purple Tops
15649,Women,Apparel,Topwear,Tops,Grey,2011,Sports,Nike Women Trainng Grey Tops
16130,Women,Apparel,Topwear,Tops,Pink,2011,Casual,Tokyo Talkies Women Printed Pink Top
16133,Women,Apparel,Topwear,Tops,Grey,2011,Casual,Tokyo Talkies Women Printed Grey Top
16134,Women,Apparel,Topwear,Tops,Blue,2011,Casual,Tokyo Talkies Women Printed Blue Top
16135,Women,Apparel,Topwear,Tops,White,2011,Casual,Tokyo Talkies Women Printed White Top
16136,Women,Apparel,Topwear,Tops,Blue,2011,Casual,Tokyo Talkies Women Printed Blue Top
16137,Women,Apparel,Topwear,Tops,Pink,2011,Casual,Tokyo Talkies Women Printed Pink Top
16139,Women,Apparel,Topwear,Tops,White,2011,Casual,Tokyo Talkies Women Printed White Top
16140,Women,Apparel,Topwear,Tops,Orange,2011,Casual,Tokyo Talkies Women Printed Orange Top
16141,Women,Apparel,Topwear,Tops,Yellow,2011,Casual,Tokyo Talkies Women Printed Yellow Top
16142,Women,Apparel,Topwear,Tops,White,2011,Casual,Tokyo Talkies Women Printed White Top
16145,Women,Apparel,Topwear,Tops,Grey,2011,Casual,Tokyo Talkies Women Printed Grey Top
16146,Women,Apparel,Topwear,Tops,Grey,2011,Casual,Tokyo Talkies Women Printed Grey Top
16147,Women,Apparel,Topwear,Tops,Grey,2011,Casual,Tokyo Talkies Women Printed Grey Top
16148,Women,Apparel,Topwear,Tops,Blue,2011,Casual,Tokyo Talkies Women Printed Blue Top
16271,Women,Apparel,Topwear,Tops,White,2011,Casual,Tokyo Talkies Women Printed White Top
16534,Women,Apparel,Topwear,Tops,Pink,2011,Casual,Tokyo Talkies Women Printed PinkTop
16606,Women,Apparel,Topwear,Tops,Purple,2011,Casual,Jealous 21 Women Solid Purple Knit Top
16607,Women,Apparel,Topwear,Tops,Magenta,2011,Casual,Jealous 21 Women Solid Magenta Knit Top
16608,Women,Apparel,Topwear,Tops,Green,2011,Casual,Jealous 21 Women Printed Green Top
17617,Women,Apparel,Topwear,Tops,Green,2011,Casual,Doodle  Flower Girl Green Top
17850,Women,Apparel,Topwear,Tops,Grey,2011,Casual,Flying Machine Women Sequins Grey Top
18714,Women,Apparel,Topwear,Tops,Magenta,2011,Casual,Arrow Woman Issey Magenta Top
