id,gender,masterCategory,subCategory,articleType,baseColour,year,usage,productDisplayName
41172,Women,Apparel,Topwear,Shirts,Orange,2012,Casual,Allen Solly Woman Orange Shirt
41194,Women,Apparel,Topwear,Shirts,Grey,2012,Casual,Allen Solly Woman Grey Shirt
41384,Women,Apparel,Topwear,Shirts,Pink,2012,Casual,Wrangler Women Pink Shirt
41385,Women,Apparel,Topwear,Shirts,Green,2012,Casual,Wrangler Women Green Candy Shirt
41388,Women,Apparel,Topwear,Shirts,Pink,2012,Casual,Wrangler Women Pink Shirt
42366,Women,Apparel,Topwear,Shirts,Pink,2012,Casual,Flying Machine Women Multicoloured Printed Shirt
43226,Women,Apparel,Topwear,Shirts,Purple,2012,Casual,United Colors of Benetton Women Purple Printed Shirt
43304,Women,Apparel,Topwear,Shirts,White,2012,Casual,United Colors of Benetton Women White Shirt
43305,Women,Apparel,Topwear,Shirts,Pink,2012,Casual,United Colors of Benetton Women Pink Shirt
43306,Women,Apparel,Topwear,Shirts,Black,2012,Casual,United Colors of Benetton Women Black Shirt
43307,Women,Apparel,Topwear,Shirts,White,2012,Casual,United Colors of Benetton Women White Shirt
43308,Women,Apparel,Topwear,Shirts,Pink,2012,Casual,United Colors of Benetton Women Pink Shirt
43629,Women,Apparel,Topwear,Shirts,Black,2012,Casual,Vero Moda Women Black Shirt
43630,Women,Apparel,Topwear,Shirts,Red,2012,Casual,Vero Moda Women Red Shirt
43631,Women,Apparel,Topwear,Shirts,Green,2012,Casual,Vero Moda Women Green Shirt
43910,Women,Apparel,Topwear,Shirts,Green,2012,Casual,W Women Green Shirt
44655,Women,Apparel,Topwear,Shirts,Red,2012,Casual,Lee Women Rebecca Red Shirt
44656,Women,Apparel,Topwear,Shirts,Blue,2012,Casual,Lee Women Blue Shirt
44668,Women,Apparel,Topwear,Shirts,Pink,2012,Casual,Wills Lifestyle Women Pink Shirt
44669,Women,Apparel,Topwear,Shirts,White,2012,Casual,Wills Lifestyle Women White Shirt
44670,Women,Apparel,Topwear,Shirts,White,2012,Smart Casual,Wills Lifestyle Women Eliza White Shirt
44674,Women,Apparel,Topwear,Shirts,Black,2012,Casual,Wills Lifestyle Women Black Shirt
44675,Women,Apparel,Topwear,Shirts,Yellow,2012,Casual,Wills Lifestyle Women Yellow Shirt
44676,Women,Apparel,Topwear,Shirts,White,2012,Casual,Wills Lifestyle Women White Shirt
44696,Women,Apparel,Topwear,Shirts,White,2012,Casual,Wills Lifestyle Women Navy Blue Shirt
44702,Women,Apparel,Topwear,Shirts,Blue,2012,Casual,Wills Lifestyle Women Blue Shirt
44708,Women,Apparel,Topwear,Shirts,Blue,2012,Casual,Wills Lifestyle Women Blue Striped Shirt
47662,Women,Apparel,Topwear,Shirts,Multi,2012,Casual,Femella Women Multi Coloured Floral Print Shirt
48091,Women,Apparel,Topwear,Shirts,Blue,2012,Casual,French Connection Women Blue Shirt
48093,Women,Apparel,Topwear,Shirts,Blue,2012,Casual,French Connection Women Blue Shirt
51432,Women,Apparel,Topwear,Shirts,White,2012,Casual,Myntra Women White Check Shirt
51433,Women,Apparel,Topwear,Shirts,Pink,2012,Casual,Myntra Women Pink Checked Casual Shirt
51434,Women,Apparel,Topwear,Shirts,Turquoise Blue,2012,Casual,Myntra Women Turquoise Blue Check Shirt
51435,Women,Apparel,Topwear,Shirts,Pink,2012,Casual,Myntra Women Pink Top
51443,Women,Apparel,Topwear,Shirts,Yellow,2012,Casual,Myntra Women Yellow Shirt
51444,Women,Apparel,Topwear,Shirts,Blue,2012,Formal,Myntra Women Light Blue Shirt
54975,Women,Apparel,Topwear,Shirts,Black,2012,Casual,Femella Women Black Shirt
54979,Women,Apparel,Topwear,Shirts,White,2012,Casual,Femella Women White Printed Shirt
54981,Women,Apparel,Topwear,Shirts,White,2012,Casual,Femella Women Multi Coloured Shirt
54989,Women,Apparel,Topwear,Shirts,Pink,2012,Casual,Femella Women Pink Shirt
54993,Women,Apparel,Topwear,Shirts,White,2012,Casual,Femella Women White Printed Shirt
57033,Women,Apparel,Topwear,Shirts,Black,2012,Casual,Forever New Women Black Shirt
57080,Women,Apparel,Topwear,Shirts,Blue,2012,Casual,Elle Women Blue Shirt
57110,Women,Apparel,Topwear,Shirts,Blue,2012,Casual,Elle Women Blue Shirt
57128,Women,Apparel,Topwear,Shirts,Grey,2012,Casual,Elle Women Grey Retro Top
57992,Women,Apparel,Topwear,Shirts,Purple,2012,Casual,Latin Quarters Women Purple Shirt
58511,Women,Apparel,Topwear,Shirts,White,2012,Casual,Tonga Women White Shirt
59874,Women,Apparel,Topwear,Shirts,Green,2012,Casual,Femella Women Green Check Shirt
59875,Women,Apparel,Topwear,Shirts,Green,2012,Casual,Femella Women Green Shirt
59891,Women,Apparel,Topwear,Shirts,Multi,2012,Casual,Femella Women Multi Coloured Shirt
59892,Women,Apparel,Topwear,Shirts,Blue,2012,Casual,Femella Women Blue Shirt
59893,Women,Apparel,Topwear,Shirts,Blue,2012,Casual,Femella Women Blue Shirt
59894,Women,Apparel,Topwear,Shirts,Orange,2012,Casual,Femella Women Orange Shirt
21431,Women,Apparel,Bottomwear,Shorts,White,2012,Casual,Roxy Women White Shorts
21433,Women,Apparel,Bottomwear,Shorts,Blue,2012,Casual,Roxy Women Beach Brights Blue Shorts
21434,Women,Apparel,Bottomwear,Shorts,Blue,2012,Casual,roxy Women Beach Brights Blue Short
26984,Women,Apparel,Bottomwear,Shorts,Blue,2012,Casual,Jealous 21 Women Blue Shorts
26985,Women,Apparel,Bottomwear,Shorts,Pink,2012,Casual,Jealous 21 Women Pink Shorts
26986,Women,Apparel,Bottomwear,Shorts,Purple,2012,Casual,Jealous 21 Women Purple Shorts
26987,Women,Apparel,Bottomwear,Shorts,Black,2012,Casual,Jealous 21 Women Black Shorts
26990,Women,Apparel,Bottomwear,Shorts,Blue,2012,Casual,Jealous 21 Women Washed Blue Shorts
27026,Women,Apparel,Bottomwear,Shorts,Blue,2012,Casual,Jealous 21 Women Blue Cropped Denim Shorts
27027,Women,Apparel,Bottomwear,Shorts,Blue,2012,Casual,Jealous 21 Women Blue Shorts
27232,Women,Apparel,Bottomwear,Shorts,Pink,2012,Casual,Doodle Kids Girl Check Pink Shorts
28459,Women,Apparel,Bottomwear,Shorts,Purple,2012,Sports,Urban Yoga Women Purple Shorts
28460,Women,Apparel,Bottomwear,Shorts,Pink,2012,Sports,Urban Yoga Women Pink Shorts
28463,Women,Apparel,Bottomwear,Shorts,Black,2012,Sports,Urban Yoga Women Black Shorts
30636,Women,Apparel,Bottomwear,Shorts,Blue,2012,Sports,Nike Women Printed Tempo Blue Shorts
30637,Women,Apparel,Bottomwear,Shorts,Red,2012,Sports,Nike Women Printed Tempo Red Shorts
30638,Women,Apparel,Bottomwear,Shorts,Black,2012,Sports,Nike Women Tempo Black Shorts
30639,Women,Apparel,Bottomwear,Shorts,Purple,2012,Sports,Nike Women Tempo Purple Shorts
32587,Women,Apparel,Bottomwear,Shorts,Black,2012,Casual,Only  Women Black Shorts
32588,Women,Apparel,Bottomwear,Shorts,Brown,2012,Casual,Only Women Brown Shorts
32589,Women,Apparel,Bottomwear,Shorts,Black,2012,Casual,Only  Women Black Shorts
32590,Women,Apparel,Bottomwear,Shorts,Brown,2012,Casual,ONLY Women Brown Shorts
32903,Women,Apparel,Bottomwear,Shorts,Red,2012,Casual,Allen Solly Women Red Shorts
33509,Women,Apparel,Bottomwear,Shorts,Pink,2012,Casual,Doodle Kids Girl Check Pink Shorts
41154,Women,Apparel,Bottomwear,Shorts,Sea Green,2012,Casual,Allen Solly Woman Light Blue  Shorts
41159,Women,Apparel,Bottomwear,Shorts,Black,2012,Casual,Allen Solly Woman Black Shorts
43309,Women,Apparel,Bottomwear,Shorts,White,2012,Casual,United Colors of Benetton Women's White Washed Shorts
43310,Women,Apparel,Bottomwear,Shorts,Pink,2012,Casual,United Colors of Benetton Womens Pink Shorts
43656,Women,Apparel,Bottomwear,Shorts,Orange,2012,Casual,ONLY Women Orange Shorts
43657,Women,Apparel,Bottomwear,Shorts,Purple,2012,Casual,ONLY Women Purple Shorts
43914,Women,Apparel,Bottomwear,Shorts,Blue,2012,Casual,Femella Women Blue Shorts
43915,Women,Apparel,Bottomwear,Shorts,Cream,2012,Casual,Femella Women Cream Shorts
43916,Women,Apparel,Bottomwear,Shorts,Yellow,2012,Casual,Femella Women Yellow Shorts
48110,Women,Apparel,Bottomwear,Shorts,Red,2012,Casual,French Connection Women Red Shorts
48111,Women,Apparel,Bottomwear,Shorts,Brown,2012,Casual,French Connection Women Light Brown Shorts
57093,Women,Apparel,Bottomwear,Shorts,Blue,2012,Casual,Elle Women Blue Shorts
57094,Women,Apparel,Bottomwear,Shorts,Blue,2012,Casual,Elle Women Greyish Blue Culottes
57095,Women,Apparel,Bottomwear,Shorts,Black,2012,Casual,Elle Women Black Culottes
57214,Women,Apparel,Bottomwear,Shorts,Blue,2012,Casual,Kraus Jeans Women Blue Shorts
57215,Women,Apparel,Bottomwear,Shorts,Beige,2012,Casual,Kraus Jeans Women Beige Shorts
57216,Women,Apparel,Bottomwear,Shorts,Brown,2012,Casual,Kraus Jeans Women Brown Shorts
57896,Women,Apparel,Bottomwear,Shorts,Off White,2012,Casual,Femella Women Off White Shorts
58491,Women,Apparel,Bottomwear,Shorts,Olive,2012,Casual,Tonga Women Olive Shorts
26371,Women,Apparel,Topwear,Shrug,Pink,2012,Casual,Arrow Woman Check Pink Shirt
51455,Women,Apparel,Topwear,Shrug,Pink,2012,Casual,Tonga Women Pink Printed Shrug
54992,Women,Apparel,Topwear,Shrug,Beige,2012,Casual,Femella Women Black & Beige Shrug
58158,Women,Apparel,Topwear,Shrug,Maroon,2012,Casual,Latin Quarters Women Maroon Shrug
58507,Women,Apparel,Topwear,Shrug,White,2012,Casual,Tonga Women Coffee Brown Shrug
25930,Women,Apparel,Bottomwear,Skirts,Black,2012,Casual,Femella Women Black Skirt
25931,Women,Apparel,Bottomwear,Skirts,Red,2012,Casual,Femella Women Red Skirt
26364,Women,Apparel,Bottomwear,Skirts,Grey,2012,Formal,Arrow Woman Grey Skirt
26863,Women,Apparel,Bottomwear,Skirts,Navy Blue,2012,Casual,Jealous 21 Women Navy Blue Skirts
27199,Women,Apparel,Bottomwear,Skirts,Grey,2012,Casual,Doodle Kids Girl Printed Grey Skirt
27231,Women,Apparel,Bottomwear,Skirts,Blue,2012,Casual,Doodle Kids Girl Washed Blue Skirt
28455,Women,Apparel,Bottomwear,Skirts,Black,2012,Sports,Urban Yoga Women Black Skirt With Leggings
28456,Women,Apparel,Bottomwear,Skirts,Blue,2012,Sports,Urban Yoga Women Blue Skirt With Leggings
30922,Women,Apparel,Bottomwear,Skirts,Rust,2012,Ethnic,Fabindia Women Printed Rust Skirt
30923,Women,Apparel,Bottomwear,Skirts,Mustard,2012,Ethnic,Fabindia Women Printed Mustard Skirt
30924,Women,Apparel,Bottomwear,Skirts,Beige,2012,Ethnic,Fabindia Women Printed Beige Ghera Skirt
30925,Women,Apparel,Bottomwear,Skirts,Black,2012,Ethnic,Fabindia Women Printed Black Ghera Skirt
30926,Women,Apparel,Bottomwear,Skirts,Blue,2012,Ethnic,Fabindia Women Blue Ghera Crinkle Skirt
30927,Women,Apparel,Bottomwear,Skirts,Red,2012,Ethnic,Fabindia Women Red Ghera Crinkle Skirt
30928,Women,Apparel,Bottomwear,Skirts,Blue,2012,Ethnic,Fabindia Women Printed Blue Skirt
30929,Women,Apparel,Bottomwear,Skirts,Grey,2012,Ethnic,Fabindia Women Grey Skirt
31454,Women,Apparel,Bottomwear,Skirts,Black,2012,Sports,Nike Women Tennis Black Skirt
31605,Women,Apparel,Bottomwear,Skirts,Black,2012,Sports,Nike Women Running Black Skirt with Capris
32250,Women,Apparel,Bottomwear,Skirts,Blue,2012,Ethnic,Fabindia Women Blue Skirts
32251,Women,Apparel,Bottomwear,Skirts,Purple,2012,Ethnic,Fabindia Women Purple Skirt
32252,Women,Apparel,Bottomwear,Skirts,Red,2012,Ethnic,Fabindia Women Red Skirts
32591,Women,Apparel,Bottomwear,Skirts,Pink,2012,Casual,ONLY Women Pink Skirt
33508,Women,Apparel,Bottomwear,Skirts,Blue,2012,Casual,Doodle Kids Girl Washed Blue Skirt
34492,Women,Apparel,Bottomwear,Skirts,Black,2012,Formal,Van Heusen Woman Black Skirt
34493,Women,Apparel,Bottomwear,Skirts,Grey,2012,Formal,Van Heusen Woman Grey Skirt
34494,Women,Apparel,Bottomwear,Skirts,Black,2012,Formal,Van Heusen Woman Black Skirt
34495,Women,Apparel,Bottomwear,Skirts,Grey,2012,Formal,Van Heusen Woman Grey Skirt
35958,Women,Apparel,Bottomwear,Skirts,Black,2012,Casual,Flying Machine Women Viscose Black Skirt
37208,Women,Apparel,Bottomwear,Skirts,Black,2012,Casual,United Colors of Benetton Women Black Skirt
37930,Women,Apparel,Bottomwear,Skirts,Brown,2012,Casual,Mineral Women Brown Skirt
39725,Women,Apparel,Bottomwear,Skirts,Charcoal,2012,Formal,Arrow Woman Charcoal Skirt
39731,Women,Apparel,Bottomwear,Skirts,Grey,2012,Formal,Arrow Woman Grey Skirt
40428,Women,Apparel,Bottomwear,Skirts,Grey,2012,Formal,Tonga Women Grey Formal Skirt
40432,Women,Apparel,Bottomwear,Skirts,Black,2012,Formal,Tonga Women Black Skirt
40433,Women,Apparel,Bottomwear,Skirts,Multi,2012,Casual,Tonga Women Multi Colored Skirt
40434,Women,Apparel,Bottomwear,Skirts,Charcoal,2012,Casual,Tonga Women Charcoal Skirt
41152,Women,Apparel,Bottomwear,Skirts,Grey,2012,Casual,Allen Solly Woman Grey Skirt
41153,Women,Apparel,Bottomwear,Skirts,Charcoal,2012,Casual,Allen Solly Woman Charcoal Skirt
43520,Women,Apparel,Bottomwear,Skirts,Navy Blue,2012,Formal,French Connection Women Navy Blue Skirt
44646,Women,Apparel,Bottomwear,Skirts,Black,2012,Formal,Arrow Woman Black Skirt
47657,Women,Apparel,Bottomwear,Skirts,Cream,2012,Casual,Femella Women Grey Printed Skirt
47658,Women,Apparel,Bottomwear,Skirts,Purple,2012,Casual,Femella Women Purple & Black Skirt
49636,Women,Apparel,Bottomwear,Skirts,Blue,2012,Casual,Mineral Blue & White Skirt
49654,Women,Apparel,Bottomwear,Skirts,Grey,2012,Casual,Mineral Women Grey Skirt
49655,Women,Apparel,Bottomwear,Skirts,Pink,2012,Casual,Mineral Pink & Green Skirt
57082,Women,Apparel,Bottomwear,Skirts,Blue,2012,Casual,Elle Women Blue Skirt
57083,Women,Apparel,Bottomwear,Skirts,Blue,2012,Casual,Elle Women Blue Skirt
57084,Women,Apparel,Bottomwear,Skirts,Blue,2012,Casual,Elle Women Blue Skirt
57085,Women,Apparel,Bottomwear,Skirts,Off White,2012,Casual,Elle Women Off-White & Orange Floral Print Tulip Skirt
57086,Women,Apparel,Bottomwear,Skirts,Pink,2012,Casual,Elle Women Pink Vintage Skirt
57087,Women,Apparel,Bottomwear,Skirts,Yellow,2012,Casual,Elle Women Yellow Skirt
57088,Women,Apparel,Bottomwear,Skirts,Teal,2012,Casual,Elle Women Teal Skirt
57089,Women,Apparel,Bottomwear,Skirts,Navy Blue,2012,Casual,Elle Women Blue Skirt
57090,Women,Apparel,Bottomwear,Skirts,Navy Blue,2012,Casual,Elle Women Navy Blue Skirt
57091,Women,Apparel,Bottomwear,Skirts,Black,2012,Casual,Elle Women Black Skirt
57092,Women,Apparel,Bottomwear,Skirts,Off White,2012,Casual,Elle Women Off White Skirt
3298,Women,Footwear,Shoes,Sports Shoes,White,2012,Sports,Asics Women Sport Gel Pulse 2 Blue White Shoe
3370,Women,Footwear,Shoes,Sports Shoes,Grey,2012,Sports,Asics Women Gel Cushioning Running Grey Pink Shoe
3375,Women,Footwear,Shoes,Sports Shoes,Blue,2012,Sports,Asics Women Gel Cushioning Active Running Blue Silver Shoe
3376,Women,Footwear,Shoes,Sports Shoes,Black,2012,Sports,Asics Women Gel Technology Active Black White Pink Shoe
8304,Women,Footwear,Shoes,Sports Shoes,Black,2012,Sports,Skechers Women Shape Ups Toner Black Shoe
8306,Women,Footwear,Shoes,Sports Shoes,Black,2012,Sports,Skechers Women Sports Black Pink White Shoe
10125,Women,Footwear,Shoes,Sports Shoes,White,2012,Sports,Reebok Women Premier Zigfly White Sports Shoes
11927,Women,Footwear,Shoes,Sports Shoes,White,2012,Sports,Skechers Women Tone White Sports Shoes
12693,Women,Footwear,Shoes,Sports Shoes,White,2012,Sports,Nike Women Transform White Sports Shoes
13201,Women,Footwear,Shoes,Sports Shoes,White,2012,Sports,ASICS Women Ilyeo II Running White Sports Shoes
13205,Women,Footwear,Shoes,Sports Shoes,Grey,2012,Sports,ASICS Women Gel 1160 Running Grey Sports Shoes
13210,Women,Footwear,Shoes,Sports Shoes,White,2012,Sports,ASICS Women GT 2160 Running White Sports Shoes
13212,Women,Footwear,Shoes,Sports Shoes,Grey,2012,Sports,ASICS Women Gel Spree Running Grey Sports Shoes
13213,Women,Footwear,Shoes,Sports Shoes,White,2012,Sports,ASICS Women Gel Cumulus Running White Sports Shoes
15412,Women,Footwear,Shoes,Sports Shoes,White,2012,Sports,Fila Women Hex II White And Black Sports Shoes
15418,Women,Footwear,Shoes,Sports Shoes,White,2012,Sports,Fila Women Hex II White Sports Shoes
15745,Women,Footwear,Shoes,Sports Shoes,Silver,2012,Sports,Nike Women Transform III Silver Sports Shoes
18409,Women,Footwear,Shoes,Sports Shoes,Black,2012,Sports,Skechers Women Prospeed Black Shoe
18411,Women,Footwear,Shoes,Sports Shoes,White,2012,Sports,Skechers Women Shape-Ups White Shoe
18420,Women,Footwear,Shoes,Sports Shoes,White,2012,Sports,Skechers Women Shape-Ups White Shoe
18421,Women,Footwear,Shoes,Sports Shoes,White,2012,Sports,Skechers Women Shape-Ups White Shoe
24409,Women,Footwear,Shoes,Sports Shoes,White,2012,Sports,ADIDAS Women White & Grey Vanquish Sports Shoes
24455,Women,Footwear,Shoes,Sports Shoes,White,2012,Casual,Nike Women Court Majestic White Shoes
24456,Women,Footwear,Shoes,Sports Shoes,White,2012,Sports,Nike Women Air Max White Sports Shoes
25459,Women,Footwear,Shoes,Sports Shoes,Silver,2012,Sports,Nike Women Dart 9 MSL Silver Sports Shoes
25460,Women,Footwear,Shoes,Sports Shoes,White,2012,Sports,Nike Women Dart 9 MSL White Sports Shoes
25464,Women,Footwear,Shoes,Sports Shoes,Black,2012,Sports,Nike Women Downshifter Black Sports Shoes
25469,Women,Footwear,Shoes,Sports Shoes,Silver,2012,Sports,Nike Women Ballista II Silver Sports Shoes
26449,Women,Footwear,Shoes,Sports Shoes,Silver,2012,Sports,Puma Women Kuris Wn's Ind. Purple and Silver Sports Shoes
26450,Women,Footwear,Shoes,Sports Shoes,Black,2012,Sports,Puma Women Kuris Black Sports Shoes
26600,Women,Footwear,Shoes,Sports Shoes,Black,2012,Sports,Puma Women Faas 300 Black Sports Shoes
26604,Women,Footwear,Shoes,Sports Shoes,White,2012,Sports,Puma Women Bodytrain White Sports Shoes
26605,Women,Footwear,Shoes,Sports Shoes,Black,2012,Sports,Puma Women Bodytrain Black Sports Shoes
26615,Women,Footwear,Shoes,Sports Shoes,White,2012,Sports,Puma Women Bodytrain White Sports Shoes
26616,Women,Footwear,Shoes,Sports Shoes,Grey,2012,Sports,Puma Women BodyTrain Mesh Grid Grey Sports Shoes
26623,Women,Footwear,Shoes,Sports Shoes,Black,2012,Sports,Puma Women BodyTrain Mesh Grid Black Sports Shoes
26624,Women,Footwear,Shoes,Sports Shoes,Purple,2012,Sports,Puma Women Bodytrain Purple Sports Shoes
26655,Women,Footwear,Shoes,Sports Shoes,Pink,2012,Sports,Puma Women Maya Shimmer Pink Sports Shoes
26667,Women,Footwear,Shoes,Sports Shoes,White,2012,Sports,Puma Women Femme White Sports Shoes
28603,Women,Footwear,Shoes,Sports Shoes,Black,2012,Sports,Nike Women Air Rift Black Sports Shoes
29248,Women,Footwear,Shoes,Sports Shoes,White,2012,Sports,ADIDAS Women Response Cushion White Sports Shoes
29258,Women,Footwear,Shoes,Sports Shoes,White,2012,Sports,ADIDAS Women Vanquish 5 W White Sports Shoes
31207,Women,Footwear,Shoes,Sports Shoes,White,2012,Sports,Nike Women Dual Fusion White Sports Shoes
31210,Women,Footwear,Shoes,Sports Shoes,White,2012,Sports,Nike Women Air Propel White Sports Shoes
31689,Women,Footwear,Shoes,Sports Shoes,Grey,2012,Sports,Nike Women Lunarfly Grey Sports Shoes
31944,Women,Footwear,Shoes,Sports Shoes,White,2012,Sports,Nike Women Court Shuttle IV White Sports Shoes
31954,Women,Footwear,Shoes,Sports Shoes,White,2012,Sports,Nike Women Lunarfly +3 White Sports Shoes
31957,Women,Footwear,Shoes,Sports Shoes,White,2012,Sports,Nike Women White Sports Shoes
31974,Women,Footwear,Shoes,Sports Shoes,Black,2012,Sports,Nike Women Lunarglide+3 Black Sports Shoes
31975,Women,Footwear,Shoes,Sports Shoes,Grey,2012,Sports,Nike Women Lunarglide+3 Grey Sports Shoes
31976,Women,Footwear,Shoes,Sports Shoes,Grey,2012,Sports,Nike Women Lunarswift +3 Grey Sports Shoes
31977,Women,Footwear,Shoes,Sports Shoes,Olive,2012,Sports,Nike Women Lunarswift +3 Olive Sports Shoes
32175,Women,Footwear,Shoes,Sports Shoes,Black,2012,Sports,ADIDAS Women Core 50 Black Sports Shoes
32181,Women,Footwear,Shoes,Sports Shoes,Black,2012,Sports,ADIDAS Women Adi Trainer Black Sports Shoes
32190,Women,Footwear,Shoes,Sports Shoes,Pink,2012,Sports,ADIDAS Women Duramo Pink Sports Shoes
32195,Women,Footwear,Shoes,Sports Shoes,Navy Blue,2012,Sports,ADIDAS Women Oregon 11 Navy Blue Sports Shoes
32746,Women,Footwear,Shoes,Sports Shoes,Black,2012,Sports,FILA Women Skeletoes Slide Black Shoes
33823,Women,Footwear,Shoes,Sports Shoes,Grey,2012,Sports,Puma Women Axis Grey Sports Shoes
33824,Women,Footwear,Shoes,Sports Shoes,Grey,2012,Sports,Puma Women Grey Axis Sports Shoes
33825,Women,Footwear,Shoes,Sports Shoes,Silver,2012,Sports,Puma Women Kuris Silver & Grey Sports Shoes
33837,Women,Footwear,Shoes,Sports Shoes,Grey,2012,Sports,Puma Women Ikonis Grey Sports Shoes
33838,Women,Footwear,Shoes,Sports Shoes,Pink,2012,Sports,Puma Women Ikonis Pink Sports Shoes
34648,Women,Footwear,Shoes,Sports Shoes,Grey,2012,Sports,Fila Women Artifice Grey Sports Shoes
34649,Women,Footwear,Shoes,Sports Shoes,Grey,2012,Sports,Fila Women Artifice Grey Sports Shoes
34650,Women,Footwear,Shoes,Sports Shoes,Black,2012,Sports,Fila Women Top Fuel Black Sports Shoes
34651,Women,Footwear,Shoes,Sports Shoes,Black,2012,Sports,Fila Women Top Fuel Black Sports Shoes
34727,Women,Footwear,Shoes,Sports Shoes,Black,2012,Sports,Puma Women Axis XT Wn s Black Sports Shoes
34733,Women,Footwear,Shoes,Sports Shoes,Blue,2012,Sports,Puma Women Faas 300 Blue & Pink Sports Shoes
34734,Women,Footwear,Shoes,Sports Shoes,White,2012,Sports,Puma Women Osuran White Sports Shoes
34823,Women,Footwear,Shoes,Sports Shoes,White,2012,Sports,ADIDAS Women Trainer White Sports Shoes
34834,Women,Footwear,Shoes,Sports Shoes,Navy Blue,2012,Sports,ADIDAS Women Ranger Navy Blue Sports Shoes
34840,Women,Footwear,Shoes,Sports Shoes,Navy Blue,2012,Sports,ADIDAS Women Navy Blue Sports Shoes
34842,Women,Footwear,Shoes,Sports Shoes,White,2012,Sports,ADIDAS Women Falcon Elite White Sports Shoes
35423,Women,Footwear,Shoes,Sports Shoes,Blue,2012,Sports,ADIDAS Women Clima Motionwave Blue Sports Shoes
35427,Women,Footwear,Shoes,Sports Shoes,White,2012,Sports,ADIDAS Women Neptune White Sports Shoes
35428,Women,Footwear,Shoes,Sports Shoes,White,2012,Sports,ADIDAS Women Neptune White Sports Shoes
35700,Women,Footwear,Shoes,Sports Shoes,White,2012,Sports,Nike Women Court Shuttle IV White Sports Shoes
35705,Women,Footwear,Shoes,Sports Shoes,Grey,2012,Sports,Nike Women Dart 9 MSL Grey Sports Shoes
35711,Women,Footwear,Shoes,Sports Shoes,Grey,2012,Sports,Nike Women Zoom Vomero Grey Sports Shoes
35714,Women,Footwear,Shoes,Sports Shoes,Grey,2012,Sports,Force 10 Women Grey Sports Shoes
35716,Women,Footwear,Shoes,Sports Shoes,Black,2012,Sports,Force 10 Women Black Sports Shoes
36136,Women,Footwear,Shoes,Sports Shoes,Green,2012,Sports,Nike Women Free Run+ 3 Green Sports Shoes
36137,Women,Footwear,Shoes,Sports Shoes,Pink,2012,Sports,Nike Women Free Run Pink Sports Shoes
36143,Women,Footwear,Shoes,Sports Shoes,Grey,2012,Sports,Nike Women Free 4.0 V2 Grey Sports Shoes
36146,Women,Footwear,Shoes,Sports Shoes,Black,2012,Sports,Nike Women Flex 2012 RN Black Sports Shoes
36219,Women,Footwear,Shoes,Sports Shoes,Grey,2012,Sports,Nike Women Air Pegasus Grey & Blue Sports Shoes
36220,Women,Footwear,Shoes,Sports Shoes,Blue,2012,Sports,Nike Women Dual Fusion ST 2 Blue Sports Shoes
36226,Women,Footwear,Shoes,Sports Shoes,Grey,2012,Sports,Nike Women Air Max Grey & Purple Sports Shoes
36231,Women,Footwear,Shoes,Sports Shoes,White,2012,Sports,Nike Women White Revolution Sports Shoes
36232,Women,Footwear,Shoes,Sports Shoes,White,2012,Sports,Nike Women Air Dictate 2 MSL White Sports Shoes
36233,Women,Footwear,Shoes,Sports Shoes,Grey,2012,Sports,Nike Women Air Max S2S Grey Sports Shoes
36837,Women,Footwear,Shoes,Sports Shoes,Grey,2012,Sports,Nike Women Free 4.0 V2 Grey Sports Shoes
38531,Women,Footwear,Shoes,Sports Shoes,Pink,2012,Sports,Puma Women Pink Sports Shoes
38532,Women,Footwear,Shoes,Sports Shoes,Black,2012,Sports,Puma Women Black Sports Shoes
38656,Women,Footwear,Shoes,Sports Shoes,Grey,2012,Sports,Nike Women Dual Fusion Grey Sports Shoes
38673,Women,Footwear,Shoes,Sports Shoes,Purple,2012,Sports,Nike Women Purple Sports Shoes
38675,Women,Footwear,Shoes,Sports Shoes,White,2012,Sports,Nike Women Diffusion White Sports Shoes
38761,Women,Footwear,Shoes,Sports Shoes,Grey,2012,Sports,Nike Women Air Rift Grey Sports Shoes
38762,Women,Footwear,Shoes,Sports Shoes,White,2012,Sports,Nike Women Ballista II White Sports Shoes
39628,Women,Footwear,Shoes,Sports Shoes,Grey,2012,Sports,Nike Women Transform Grey Sports Shoes
39888,Women,Footwear,Shoes,Sports Shoes,White,2012,Sports,ADIDAS Women White Core 50 Sports Shoes
39896,Women,Footwear,Shoes,Sports Shoes,Blue,2012,Sports,ADIDAS Women Blue Adi Light Sports Shoes
40483,Women,Footwear,Shoes,Sports Shoes,Pink,2012,Sports,Fila Women Pink Speed Lite Sports Shoes
40485,Women,Footwear,Shoes,Sports Shoes,Grey,2012,Sports,Fila Women Grey Speed Lite Sports Shoes
41209,Women,Footwear,Shoes,Sports Shoes,Black,2012,Sports,Nike Women Black Sports Shoes
41821,Women,Footwear,Shoes,Sports Shoes,Silver,2012,Sports,Skechers Women Silver & Pink Sports Shoes
41822,Women,Footwear,Shoes,Sports Shoes,White,2012,Sports,Skechers Women Grey & White Sports Shoes
41824,Women,Footwear,Shoes,Sports Shoes,Silver,2012,Sports,Skechers Women Silver Sports Shoes
41825,Women,Footwear,Shoes,Sports Shoes,Yellow,2012,Sports,Skechers Women Yellow & Silver Sports Shoes
41827,Women,Footwear,Shoes,Sports Shoes,White,2012,Sports,Skechers Women White Sports Shoes
41840,Women,Footwear,Shoes,Sports Shoes,White,2012,Sports,Skechers Women White Sports Shoes
41841,Women,Footwear,Shoes,Sports Shoes,Silver,2012,Sports,Skechers Women Silver Sports Shoes
41842,Women,Footwear,Shoes,Sports Shoes,Pink,2012,Sports,Skechers Women Pink Sports Shoes
41843,Women,Footwear,Shoes,Sports Shoes,Blue,2012,Sports,Skechers Women Blue & Green Sports Shoes
42025,Women,Footwear,Shoes,Sports Shoes,White,2012,Sports,ADIDAS Women White Bolt Sports Shoes
42026,Women,Footwear,Shoes,Sports Shoes,White,2012,Sports,ADIDAS Women White Bolt Sports Shoes
42027,Women,Footwear,Shoes,Sports Shoes,Black,2012,Sports,ADIDAS Women Sukoi Black Sports Shoes
42028,Women,Footwear,Shoes,Sports Shoes,White,2012,Sports,ADIDAS Women White Sukoi Sports Shoes
42029,Women,Footwear,Shoes,Sports Shoes,Purple,2012,Sports,ADIDAS Women Purple Chill Sports Shoes
42090,Women,Footwear,Shoes,Sports Shoes,Sea Green,2012,Sports,ADIDAS Women AdiLight Sea Green Sports Shoes
42091,Women,Footwear,Shoes,Sports Shoes,Black,2012,Sports,ADIDAS Women Black Adi LS Move Shoes
42148,Women,Footwear,Shoes,Sports Shoes,White,2012,Sports,Nike Women White Diffusion Sports Shoes
42985,Women,Footwear,Shoes,Sports Shoes,Grey,2012,Sports,Nike Women Grey Shoes
42989,Women,Footwear,Shoes,Sports Shoes,Black,2012,Sports,Nike Women Black Fivekay Sports Shoes
42990,Women,Footwear,Shoes,Sports Shoes,White,2012,Sports,Nike Women White Fivekay Sports Shoes
