id,gender,masterCategory,subCategory,articleType,baseColour,year,usage,productDisplayName
52539,Women,Apparel,Bottomwear,Jeans,Blue,2012,Casual,Pepe Jeans Women Blue Jeans
52547,Women,Apparel,Bottomwear,Jeans,Blue,2012,Casual,Pepe Jeans Women Blue Jeans
52553,Women,Apparel,Bottomwear,Jeans,Blue,2012,Casual,Pepe Jeans Women Blue Jeans
52554,Women,Apparel,Bottomwear,Jeans,Blue,2012,Casual,Pepe Jeans Women Blue Jeans
52555,Women,Apparel,Bottomwear,Jeans,Blue,2012,Casual,Pepe Jeans Women Blue Jeans
52556,Women,Apparel,Bottomwear,Jeans,Blue,2012,Casual,Pepe Jeans Women Blue Jeans
52557,Women,Apparel,Bottomwear,Jeans,Blue,2012,Casual,Pepe Jeans Women Blue Jeans
54334,Women,Apparel,Bottomwear,Jeans,Blue,2012,Casual,Tokyo Talkies Women Blue Straight Skinny Fit Jeans
57070,Women,Apparel,Bottomwear,Jeans,Blue,2012,Casual,Elle Women Blue Jeans
57071,Women,Apparel,Bottomwear,Jeans,Black,2012,Casual,Elle Women Black Jeans
57072,Women,Apparel,Bottomwear,Jeans,Blue,2012,Casual,Elle Women Blue Jeans
57073,Women,Apparel,Bottomwear,Jeans,Blue,2012,Casual,Elle Women Blue Jeans
57074,Women,Apparel,Bottomwear,Jeans,Black,2012,Casual,Elle Women Black Jeans
57075,Women,Apparel,Bottomwear,Jeans,Blue,2012,Casual,Elle Blue Jeans
57076,Women,Apparel,Bottomwear,Jeans,Blue,2012,Casual,Elle Women Blue Jeans
57077,Women,Apparel,Bottomwear,Jeans,Blue,2012,Casual,Elle Women Light Blue Jeans
57209,Women,Apparel,Bottomwear,Jeans,Blue,2012,Casual,Kraus Jeans Women Blue Jeans
58222,Women,Apparel,Bottomwear,Jeans,Blue,2012,Casual,Vero Moda Women Blue Denim Jeans
58560,Women,Apparel,Bottomwear,Jeans,Navy Blue,2012,Casual,Puma Women Navy Blue Jeans
58561,Women,Apparel,Bottomwear,Jeans,Blue,2012,Casual,Puma Women Blue Jeans
58562,Women,Apparel,Bottomwear,Jeans,Navy Blue,2012,Casual,Puma Women Navy Blue Jeans
26988,Women,Apparel,Bottomwear,Jeggings,Blue,2012,Casual,Jealous 21 Women Blue Jeggings
26989,Women,Apparel,Bottomwear,Jeggings,Black,2012,Casual,Jealous 21 Women Black Jeggings
27004,Women,Apparel,Bottomwear,Jeggings,Blue,2012,Casual,Jealous 21 Women Washed Light Blue Jeggings
27007,Women,Apparel,Bottomwear,Jeggings,Blue,2012,Casual,Jealous 21 Women Dark Blue Jeggings
27009,Women,Apparel,Bottomwear,Jeggings,Blue,2012,Casual,Jealous 21 Women Washed Blue Jeggings
33715,Women,Apparel,Bottomwear,Jeggings,Blue,2012,Casual,Pieces Women Blue Jeggings
33718,Women,Apparel,Bottomwear,Jeggings,Pink,2012,Casual,Pieces Women Pink Jeggings
33736,Women,Apparel,Bottomwear,Jeggings,Green,2012,Casual,Pieces Women Green Jeggings
37207,Women,Apparel,Bottomwear,Jeggings,Navy Blue,2012,Casual,United Colors of Benetton Women Navy Blue Jeggings
41134,Women,Apparel,Bottomwear,Jeggings,Grey,2012,Casual,Allen Solly Woman Grey Jeggings
51582,Women,Apparel,Bottomwear,Jeggings,Black,2012,Casual,Wrangler Women Black Jeggings
51583,Women,Apparel,Bottomwear,Jeggings,Navy Blue,2012,Casual,Wrangler Women Navy Blue Jeggings
51588,Women,Apparel,Bottomwear,Jeggings,Blue,2012,Casual,Wrangler Women Blue Jeggings
51589,Women,Apparel,Bottomwear,Jeggings,Blue,2012,Casual,Wrangler Women Blue Jeggings
51590,Women,Apparel,Bottomwear,Jeggings,Navy Blue,2012,Casual,Wrangler Women Navy Blue Jeggings
51592,Women,Apparel,Bottomwear,Jeggings,Black,2012,Casual,Wrangler Women Black Jeggings
51594,Women,Apparel,Bottomwear,Jeggings,Blue,2012,Casual,Wrangler Women Blue Jeggings
51597,Women,Apparel,Bottomwear,Jeggings,Blue,2012,Casual,Wrangler Women Blue Jeggings
51598,Women,Apparel,Bottomwear,Jeggings,Blue,2012,Casual,Wrangler Women Blue Jeggings
51599,Women,Apparel,Bottomwear,Jeggings,Blue,2012,Casual,Wrangler Women Blue Jeggings
51615,Women,Apparel,Bottomwear,Jeggings,Blue,2012,Casual,Kraus Jeans Women Blue Jeggings
51616,Women,Apparel,Bottomwear,Jeggings,Black,2012,Casual,Kraus Jeans Women Black Jeggings
51617,Women,Apparel,Bottomwear,Jeggings,Grey,2012,Casual,Kraus Jeans Women Grey Jeggings
51619,Women,Apparel,Bottomwear,Jeggings,White,2012,Casual,Kraus Jeans Women White Jeggings
52524,Women,Apparel,Bottomwear,Jeggings,Black,2012,Casual,Pepe Jeans Women Black Jeggings
52525,Women,Apparel,Bottomwear,Jeggings,Red,2012,Casual,Pepe Jeans Women Dark Red Jeggings
54049,Women,Apparel,Bottomwear,Jeggings,Navy Blue,2012,Casual,Myntra Women Navy Blue Jeggings
54050,Women,Apparel,Bottomwear,Jeggings,Black,2012,Casual,Myntra Women Black Jeggings
57208,Women,Apparel,Bottomwear,Jeggings,Blue,2012,Casual,Kraus Jeans Women Blue Jeggings
57210,Women,Apparel,Bottomwear,Jeggings,Blue,2012,Casual,Kraus Jeans Women Blue Jeggings
57211,Women,Apparel,Bottomwear,Jeggings,Pink,2012,Casual,Kraus Jeans Women Pink Jeggings
57212,Women,Apparel,Bottomwear,Jeggings,Blue,2012,Casual,Kraus Jeans Women Blue Jeggings
57213,Women,Apparel,Bottomwear,Jeggings,Blue,2012,Casual,Kraus Jeans Women Blue Jeggings
28966,Women,Apparel,Apparel Set,Kurta Sets,Blue,2012,Ethnic,Biba Women Blue Printed Salwar Suit with Dupatta
28968,Women,Apparel,Apparel Set,Kurta Sets,White,2012,Ethnic,Biba Women White Embroidered Churidar Kurta with Dupatta
28969,Women,Apparel,Apparel Set,Kurta Sets,Red,2012,Ethnic,Biba Women Red Embroidered Churidar Kurta with Dupatta
28970,Women,Apparel,Apparel Set,Kurta Sets,Black,2012,Ethnic,Biba Women Black Printed Churidar Kurta with Dupatta
28971,Women,Apparel,Apparel Set,Kurta Sets,Cream,2012,Ethnic,Biba Women Cream-Coloured Embroidered Churidar Kurta with Dupatta
28972,Women,Apparel,Apparel Set,Kurta Sets,Orange,2012,Ethnic,Biba Women Orange & White Printed Churidar Kurta with Dupatta
28973,Women,Apparel,Apparel Set,Kurta Sets,Yellow,2012,Ethnic,Biba Women Yellow & White Printed Churidar Kurta with Dupatta
28974,Women,Apparel,Apparel Set,Kurta Sets,Blue,2012,Ethnic,Biba Women Blue & Green Printed Churidar Kurta with Dupatta
28975,Women,Apparel,Apparel Set,Kurta Sets,Blue,2012,Ethnic,Biba Women Blue Churidar Kurta with Dupatta
28976,Women,Apparel,Apparel Set,Kurta Sets,Yellow,2012,Ethnic,Biba Women Yellow Churidar Kurta with Dupatta
28977,Women,Apparel,Apparel Set,Kurta Sets,Green,2012,Ethnic,Biba Women Green Churidar Kurta with Dupatta
28978,Women,Apparel,Apparel Set,Kurta Sets,White,2012,Ethnic,Biba Women White Churidar Kurta with Dupatta
28979,Women,Apparel,Apparel Set,Kurta Sets,Black,2012,Ethnic,Biba Women Black Churidar Kurta with Dupatta
28980,Women,Apparel,Apparel Set,Kurta Sets,Yellow,2012,Ethnic,Biba Women Yellow & Green Printed Churidar Kurta with Dupatta
28981,Women,Apparel,Apparel Set,Kurta Sets,Cream,2012,Ethnic,Biba Outlet Women Cream-Coloured Printed  Churidar Kurta with Dupatta
28982,Women,Apparel,Apparel Set,Kurta Sets,Green,2012,Ethnic,Biba Outlet Women Green Printed Churidar Kurta with Dupatta
28984,Women,Apparel,Apparel Set,Kurta Sets,Orange,2012,Ethnic,Biba Outlet Women Orange Printed Churidar Kurta with Dupatta
28985,Women,Apparel,Apparel Set,Kurta Sets,White,2012,Ethnic,Biba Outlet Women White & Green Printed Churidar Kurta with Dupatta
28986,Women,Apparel,Apparel Set,Kurta Sets,Orange,2012,Ethnic,Biba Outlet Women Orange & White Printed Churidar Kurta with Dupatta
28987,Women,Apparel,Apparel Set,Kurta Sets,White,2012,Ethnic,Biba Outlet Women White Printed Churidar Kurta with Dupatta
28988,Women,Apparel,Apparel Set,Kurta Sets,White,2012,Ethnic,Biba Outlet Women White & Grey Printed Salwar Suit with Dupatta
28989,Women,Apparel,Apparel Set,Kurta Sets,Blue,2012,Ethnic,Biba Outlet Women Blue & Green Printed Churidar Kurta with Dupatta
28990,Women,Apparel,Apparel Set,Kurta Sets,Pink,2012,Ethnic,Biba Outlet Women Pink Printed Churidar Kurta with Dupatta
28991,Women,Apparel,Apparel Set,Kurta Sets,Off White,2012,Ethnic,Biba Outlet Women Off-White Printed A-Line Churidar Kurta with Dupatta
39134,Women,Apparel,Apparel Set,Kurta Sets,Multi,2012,Ethnic,Aneri Women Multi Coloured Salwar Suit
39135,Women,Apparel,Apparel Set,Kurta Sets,Brown,2012,Ethnic,Aneri Women Printed Brown Salwar Suit
39136,Women,Apparel,Apparel Set,Kurta Sets,Blue,2012,Ethnic,Aneri Women Blue & White Printed Salwar Suit
39137,Women,Apparel,Apparel Set,Kurta Sets,Purple,2012,Ethnic,Aneri Women Gypsy Rose Purple Salwar Suit
39138,Women,Apparel,Apparel Set,Kurta Sets,Pink,2012,Ethnic,Aneri Women Pink & White Salwar Suit
39139,Women,Apparel,Apparel Set,Kurta Sets,White,2012,Ethnic,Aneri Women White & Black Printed Salwar Suit
39140,Women,Apparel,Apparel Set,Kurta Sets,Black,2012,Ethnic,Aneri Women Black & Maroon Salwar Suit
39141,Women,Apparel,Apparel Set,Kurta Sets,Magenta,2012,Ethnic,Aneri Women Magenta Salwar Suit
39142,Women,Apparel,Apparel Set,Kurta Sets,Blue,2012,Ethnic,Aneri Women Blue & White Salwar Suit
39143,Women,Apparel,Apparel Set,Kurta Sets,Blue,2012,Ethnic,Aneri Women Blue & Maroon Printed Salwar Suit
39144,Women,Apparel,Apparel Set,Kurta Sets,Purple,2012,Ethnic,Aneri Women Purple & Blue Salwar Suit
39145,Women,Apparel,Apparel Set,Kurta Sets,Multi,2012,Ethnic,Aneri Women Multi Coloured Salwar Suit
39146,Women,Apparel,Apparel Set,Kurta Sets,Purple,2012,Ethnic,Aneri Women Purple Ombre Churidar Kurta & Dupatta Set
39147,Women,Apparel,Apparel Set,Kurta Sets,Purple,2012,Ethnic,Aneri Women Purple Salwar Suit
43437,Women,Apparel,Apparel Set,Kurta Sets,Pink,2012,Ethnic,Global Desi Women Pink & Orange Printed Anarkali Churidar Kurta with Duptatta
53812,Women,Apparel,Apparel Set,Kurta Sets,Black,2012,Ethnic,Ayaany Women Black Patiala Kurta Set
53814,Women,Apparel,Apparel Set,Kurta Sets,Blue,2012,Ethnic,Ayaany Women Blue & Grey Patiala Kurta Set
53817,Women,Apparel,Apparel Set,Kurta Sets,White,2012,Ethnic,Ayaany Women White & Green Self-Design Patiala Kurta Set
53825,Women,Apparel,Apparel Set,Kurta Sets,Teal,2012,Ethnic,Ayaany Women Teal & Purple Embroidered Churidar Kurta with Dupatta
54686,Women,Apparel,Apparel Set,Kurta Sets,Yellow,2012,Ethnic,Shree Women Yellow & Brown Printed Salwar Suit with Dupatta
54688,Women,Apparel,Apparel Set,Kurta Sets,Pink,2012,Ethnic,Shree Women Pink & Black Printed Salwar Suit with Dupatta
54689,Women,Apparel,Apparel Set,Kurta Sets,Green,2012,Ethnic,Shree Women Green and Blue Printed Patiala Kurta Set
54703,Women,Apparel,Apparel Set,Kurta Sets,Black,2012,Ethnic,Shree Women Black & Pink Salwar Suit with Dupatta
54704,Women,Apparel,Apparel Set,Kurta Sets,Beige,2012,Ethnic,Shree Women Beige and Red Salwar Suit with Dupatta
54705,Women,Apparel,Apparel Set,Kurta Sets,Navy Blue,2012,Ethnic,Shree Women Navy & Beige Salwar Suit with Dupatta
54712,Women,Apparel,Apparel Set,Kurta Sets,Black,2012,Ethnic,Shree Women Black & White Printed Salwar Suit with Dupatta
54713,Women,Apparel,Apparel Set,Kurta Sets,Cream,2012,Ethnic,Shree Women Cream-Coloured & Pink Printed Salwar Suit with Dupatta
54714,Women,Apparel,Apparel Set,Kurta Sets,Charcoal,2012,Ethnic,Shree Women Charcoal Grey & Sea Green Printed Salwar Suit with Dupatta
54715,Women,Apparel,Apparel Set,Kurta Sets,Beige,2012,Ethnic,Shree Women Beige & Red Salwar Suit with Dupatta
54721,Women,Apparel,Apparel Set,Kurta Sets,White,2012,Ethnic,Shree Women White and Blue Printed Patiala Kurta Set
54722,Women,Apparel,Apparel Set,Kurta Sets,Yellow,2012,Ethnic,Shree Women Yellow & Red Printed Salwar Suit with Dupatta
54723,Women,Apparel,Apparel Set,Kurta Sets,Magenta,2012,Ethnic,Shree Women Magenta and Yellow Printed Patiala Kurta Set
54724,Women,Apparel,Apparel Set,Kurta Sets,Black,2012,Ethnic,Shree Women Black and Yellow Printed Patiala Kurta Set
56805,Women,Apparel,Apparel Set,Kurta Sets,Magenta,2012,Ethnic,Aneri Women Magenta Salwar Suit
18255,Women,Apparel,Topwear,Kurtas,Off White,2012,Ethnic,Aneri Women Multi Coloured Kurta
23217,Women,Apparel,Topwear,Kurtas,Purple,2012,Ethnic,Aneri Women Neeru Brown and Purple Printed Kurta
24233,Women,Apparel,Topwear,Kurtas,Brown,2012,Ethnic,La-Emotio Women Caramel Brown Kurta
24395,Women,Apparel,Topwear,Kurtas,Blue,2012,Ethnic,Vishudh Women Blue Printed Kurta
24398,Women,Apparel,Topwear,Kurtas,Red,2012,Ethnic,Vishudh Women Red Printed Kurta
24400,Women,Apparel,Topwear,Kurtas,Black,2012,Ethnic,Vishudh Women Black Printed Kurta
24401,Women,Apparel,Topwear,Kurtas,Brown,2012,Ethnic,Vishudh Women Brown Printed Kurta
24403,Women,Apparel,Topwear,Kurtas,Blue,2012,Ethnic,Vishudh Women Blue Printed Kurta
24404,Women,Apparel,Topwear,Kurtas,Purple,2012,Ethnic,Vishudh Women Purple Printed Kurta
24405,Women,Apparel,Topwear,Kurtas,Blue,2012,Ethnic,Vishudh Women Blue Printed Kurta
24406,Women,Apparel,Topwear,Kurtas,Red,2012,Ethnic,Vishudh Women Red Printed Kurta
24407,Women,Apparel,Topwear,Kurtas,Pink,2012,Ethnic,Vishudh Women Pink Printed Kurta
25818,Women,Apparel,Topwear,Kurtas,Pink,2012,Ethnic,Diva Women Printed Pink Kurta
25819,Women,Apparel,Topwear,Kurtas,Grey,2012,Ethnic,Diva Women Printed Grey Kurta
25820,Women,Apparel,Topwear,Kurtas,Cream,2012,Ethnic,Diva Women Printed Cream Kurta
25821,Women,Apparel,Topwear,Kurtas,White,2012,Ethnic,Diva Women White Printed Kurta
25822,Women,Apparel,Topwear,Kurtas,Green,2012,Ethnic,Diva Women Printed Green Kurta
25823,Women,Apparel,Topwear,Kurtas,Brown,2012,Ethnic,Diva Women Printed Brown Kurta
25824,Women,Apparel,Topwear,Kurtas,Mustard,2012,Ethnic,Diva Women Printed Mustard Kurta
25825,Women,Apparel,Topwear,Kurtas,White,2012,Ethnic,Diva Women Printed White Kurta
25826,Women,Apparel,Topwear,Kurtas,Brown,2012,Ethnic,Diva Women Printed Brown Kurta
25827,Women,Apparel,Topwear,Kurtas,Silver,2012,Ethnic,Diva Women Printed Beige Kurta
25828,Women,Apparel,Topwear,Kurtas,Pink,2012,Ethnic,Diva Women Printed Pink Kurta
25829,Women,Apparel,Topwear,Kurtas,Green,2012,Ethnic,Diva Women Printed Green Kurta
25830,Women,Apparel,Topwear,Kurtas,Lavender,2012,Ethnic,Diva Women Printed Lavender Kurta
25831,Women,Apparel,Topwear,Kurtas,White,2012,Ethnic,Diva Women Printed White Kurta
25832,Women,Apparel,Topwear,Kurtas,Cream,2012,Ethnic,Diva Women Printed Cream Kurta
25833,Women,Apparel,Topwear,Kurtas,Pink,2012,Ethnic,Diva Women Printed Pink Kurta
25834,Women,Apparel,Topwear,Kurtas,White,2012,Ethnic,Diva Women Printed White Kurta
25835,Women,Apparel,Topwear,Kurtas,Multi,2012,Ethnic,Diva Women Printed Multi Coloured Kurta
25836,Women,Apparel,Topwear,Kurtas,Peach,2012,Ethnic,Diva Women Printed Orange Kurta
25837,Women,Apparel,Topwear,Kurtas,Lavender,2012,Ethnic,Diva Women Printed Lavender Kurta
25839,Women,Apparel,Topwear,Kurtas,Red,2012,Ethnic,Diva Women Printed Red Kurta
25840,Women,Apparel,Topwear,Kurtas,Beige,2012,Ethnic,Diva Women Printed Beige Kurta
25841,Women,Apparel,Topwear,Kurtas,Brown,2012,Ethnic,Diva Women Brown Kurta
25842,Women,Apparel,Topwear,Kurtas,Multi,2012,Ethnic,Diva Women Printed Multi Coloured Kurta
25843,Women,Apparel,Topwear,Kurtas,Purple,2012,Ethnic,Diva Women Printed Purple Kurta
25845,Women,Apparel,Topwear,Kurtas,White,2012,Ethnic,Diva Women Printed White Kurta
25846,Women,Apparel,Topwear,Kurtas,Multi,2012,Ethnic,Diva Women Printed Multi Coloured Kurta
25849,Women,Apparel,Topwear,Kurtas,Black,2012,Ethnic,Diva Women Printed Black Kurta
25851,Women,Apparel,Topwear,Kurtas,Maroon,2012,Ethnic,Diva Women Printed Maroon Kurta
25852,Women,Apparel,Topwear,Kurtas,Green,2012,Ethnic,Diva Women Printed Green Kurta
25853,Women,Apparel,Topwear,Kurtas,Beige,2012,Ethnic,Diva Women Printed Beige Kurta
25856,Women,Apparel,Topwear,Kurtas,Black,2012,Ethnic,Diva Women Black Floral Print Kurti
27087,Women,Apparel,Topwear,Kurtas,Black,2012,Ethnic,Aneri Women Egyptian Black Kurta
27088,Women,Apparel,Topwear,Kurtas,Black,2012,Ethnic,Aneri Women Aaliya Black Kurta
27089,Women,Apparel,Topwear,Kurtas,Brown,2012,Ethnic,Aneri Women Jazz Brown Kurta
27090,Women,Apparel,Topwear,Kurtas,Grey,2012,Ethnic,Aneri Women Paakhi Grey Kurta
27091,Women,Apparel,Topwear,Kurtas,Brown,2012,Ethnic,Aneri Women Shila Brown Kurta
27092,Women,Apparel,Topwear,Kurtas,Brown,2012,Ethnic,Aneri Women Monika Brown Kurta
27093,Women,Apparel,Topwear,Kurtas,Multi,2012,Ethnic,Aneri Women Mitu Multi Coloured Kurta
27094,Women,Apparel,Topwear,Kurtas,Red,2012,Ethnic,Aneri Women Gazal Red Kurta
27096,Women,Apparel,Topwear,Kurtas,Cream,2012,Ethnic,Aneri Women Prachi Cream Kurta
27097,Women,Apparel,Topwear,Kurtas,Blue,2012,Ethnic,Aneri Women Blue Printed Kurta
27099,Women,Apparel,Topwear,Kurtas,Green,2012,Ethnic,Aneri Women Green Kurta
27100,Women,Apparel,Topwear,Kurtas,Blue,2012,Ethnic,Aneri Women Tamanna Blue Kurta
27101,Women,Apparel,Topwear,Kurtas,Yellow,2012,Ethnic,Aneri Women Madhuri Yellow Kurta
27102,Women,Apparel,Topwear,Kurtas,Multi,2012,Ethnic,Aneri Women Multi Coloured Kurta
27103,Women,Apparel,Topwear,Kurtas,Maroon,2012,Ethnic,Aneri Women Aarna Maroon Kurta
27104,Women,Apparel,Topwear,Kurtas,Black,2012,Ethnic,Aneri Women Naahar Black Kurta
27105,Women,Apparel,Topwear,Kurtas,Lavender,2012,Ethnic,Aneri Women Shruti Lavender Kurta
27106,Women,Apparel,Topwear,Kurtas,Yellow,2012,Ethnic,Aneri Women Shruti Yellow Kurta
27107,Women,Apparel,Topwear,Kurtas,Black,2012,Ethnic,Aneri Women Khajana Black Kurta
27108,Women,Apparel,Topwear,Kurtas,Blue,2012,Ethnic,Aneri Women Priya Blue Kurta
27109,Women,Apparel,Topwear,Kurtas,Orange,2012,Ethnic,Aneri Women Chanchal Orange Kurta
27110,Women,Apparel,Topwear,Kurtas,Pink,2012,Ethnic,Aneri Women Rani Pink Kurta
27292,Women,Apparel,Topwear,Kurtas,Navy Blue,2012,Ethnic,Mother Earth Women Printed Navy Blue Kurta
27293,Women,Apparel,Topwear,Kurtas,Blue,2012,Ethnic,Mother Earth Women Blue Kurta
28475,Women,Apparel,Topwear,Kurtas,Blue,2012,Ethnic,Urban Yoga Women Printed Blue Kurta
28476,Women,Apparel,Topwear,Kurtas,Black,2012,Ethnic,Urban Yoga Women Printed Black Kurta
28477,Women,Apparel,Topwear,Kurtas,Purple,2012,Ethnic,Urban Yoga Women Printed Purple Kurta
28688,Women,Apparel,Topwear,Kurtas,Pink,2012,Ethnic,W Women Printed Pink Kurta
28689,Women,Apparel,Topwear,Kurtas,Black,2012,Casual,W Women Black Tunic
28690,Women,Apparel,Topwear,Kurtas,Beige,2012,Ethnic,W Women Printed Beige Kurta
28691,Women,Apparel,Topwear,Kurtas,Black,2012,Ethnic,W Women Printed Black Kurta
28692,Women,Apparel,Topwear,Kurtas,Rust,2012,Ethnic,W Women Printed Rust Kurta
28693,Women,Apparel,Topwear,Kurtas,Rust,2012,Ethnic,W Women Striped Rust Kurta
28694,Women,Apparel,Topwear,Kurtas,Black,2012,Ethnic,W Women Printed Black Kurta
28695,Women,Apparel,Topwear,Kurtas,Beige,2012,Ethnic,W Women Printed Beige Kurta
28696,Women,Apparel,Topwear,Kurtas,Rust,2012,Ethnic,W Women Printed Rust Kurta
28697,Women,Apparel,Topwear,Kurtas,Black,2012,Ethnic,W Women Printed Black Kurta
28698,Women,Apparel,Topwear,Kurtas,Brown,2012,Ethnic,W Women Printed Brown Kurta
28699,Women,Apparel,Topwear,Kurtas,Pink,2012,Ethnic,W Women Printed  Light Pink Kurta
28700,Women,Apparel,Topwear,Kurtas,Peach,2012,Ethnic,W Women Printed Peach Kurta
28701,Women,Apparel,Topwear,Kurtas,Purple,2012,Ethnic,W Women Printed Purple & Green Kurta
28702,Women,Apparel,Topwear,Kurtas,Grey,2012,Ethnic,W Women Printed Grey Kurta
28703,Women,Apparel,Topwear,Kurtas,Pink,2012,Ethnic,W Women Printed Pink Kurta
28704,Women,Apparel,Topwear,Kurtas,Lavender,2012,Ethnic,W Women Printed Lavender Kurta
28705,Women,Apparel,Topwear,Kurtas,Peach,2012,Ethnic,W Women Printed Peach Kurta
28706,Women,Apparel,Topwear,Kurtas,Black,2012,Ethnic,W Women Printed Black Kurta
28707,Women,Apparel,Topwear,Kurtas,Off White,2012,Ethnic,W Women Printed Off White Kurta
28708,Women,Apparel,Topwear,Kurtas,Black,2012,Ethnic,W Women Black Kurta
28709,Women,Apparel,Topwear,Kurtas,Turquoise Blue,2012,Ethnic,W Women Printed Turquoise Blue Kurta
28710,Women,Apparel,Topwear,Kurtas,Multi,2012,Ethnic,W Women Printed Multi Coloured Kurta
28711,Women,Apparel,Topwear,Kurtas,White,2012,Ethnic,W Women Printed White Kurta
28712,Women,Apparel,Topwear,Kurtas,Blue,2012,Ethnic,W Women Printed Blue Kurta
28713,Women,Apparel,Topwear,Kurtas,White,2012,Ethnic,W Women Printed White Kurta
28714,Women,Apparel,Topwear,Kurtas,White,2012,Ethnic,W Women Printed White Kurta
28715,Women,Apparel,Topwear,Kurtas,Beige,2012,Ethnic,W Women Printed Magenta Kurta
28716,Women,Apparel,Topwear,Kurtas,Beige,2012,Ethnic,W Women Printed Beige Kurta
28717,Women,Apparel,Topwear,Kurtas,Purple,2012,Ethnic,W Women Printed Purple Kurta
28718,Women,Apparel,Topwear,Kurtas,White,2012,Ethnic,W Women Printed White Kurta
28719,Women,Apparel,Topwear,Kurtas,White,2012,Ethnic,W Women Printed White Kurta
28720,Women,Apparel,Topwear,Kurtas,White,2012,Ethnic,W Women White Printed Kurta
28721,Women,Apparel,Topwear,Kurtas,Beige,2012,Ethnic,W Women Printed Beige Kurta
28722,Women,Apparel,Topwear,Kurtas,Yellow,2012,Ethnic,W Women Printed Yellow Kurta
28723,Women,Apparel,Topwear,Kurtas,Multi,2012,Ethnic,W Women Printed Multi Coloured Kurta
28724,Women,Apparel,Topwear,Kurtas,White,2012,Ethnic,W Women Printed White Kurta
28725,Women,Apparel,Topwear,Kurtas,Green,2012,Ethnic,W Women Printed Green Kurta
28726,Women,Apparel,Topwear,Kurtas,Beige,2012,Ethnic,W Women Printed Beige Kurta
28727,Women,Apparel,Topwear,Kurtas,Cream,2012,Ethnic,W Women Printed Cream Kurta
28728,Women,Apparel,Topwear,Kurtas,White,2012,Ethnic,W Women Printed White Kurta
28729,Women,Apparel,Topwear,Kurtas,Cream,2012,Ethnic,W Women Printed Cream Kurta
28730,Women,Apparel,Topwear,Kurtas,Blue,2012,Ethnic,W Women Printed Blue Kurta
28731,Women,Apparel,Topwear,Kurtas,White,2012,Ethnic,W Women Printed White & Green Kurta
28732,Women,Apparel,Topwear,Kurtas,Green,2012,Ethnic,W Women Printed Green Kurta
28733,Women,Apparel,Topwear,Kurtas,Green,2012,Ethnic,W Women Printed Green Kurta
28734,Women,Apparel,Topwear,Kurtas,Cream,2012,Ethnic,W Women Printed Cream Kurta
28735,Women,Apparel,Topwear,Kurtas,Brown,2012,Ethnic,W Women Printed Brown Kurta
28736,Women,Apparel,Topwear,Kurtas,Purple,2012,Ethnic,W Women Printed Purple Kurta
28737,Women,Apparel,Topwear,Kurtas,White,2012,Ethnic,W Women Printed White Kurta
28738,Women,Apparel,Topwear,Kurtas,White,2012,Ethnic,W Women Printed White & Red Kurta
28741,Women,Apparel,Topwear,Kurtas,Off White,2012,Ethnic,W Women Printed Off White Kurta
28744,Women,Apparel,Topwear,Kurtas,Blue,2012,Ethnic,Aurelia Women Blue Printed Kurta
28745,Women,Apparel,Topwear,Kurtas,Orange,2012,Ethnic,Aurelia Women Printed Orange Kurta
28746,Women,Apparel,Topwear,Kurtas,Magenta,2012,Ethnic,Aurelia Women Printed Magenta Kurta
28747,Women,Apparel,Topwear,Kurtas,Black,2012,Ethnic,Aurelia Women Printed Black Kurta
28748,Women,Apparel,Topwear,Kurtas,Red,2012,Ethnic,Aurelia Women Printed Red Kurta
28749,Women,Apparel,Topwear,Kurtas,Black,2012,Ethnic,Aurelia Women Printed Black Kurta
28750,Women,Apparel,Topwear,Kurtas,Olive,2012,Ethnic,Aurelia Women Printed Olive Kurta
28751,Women,Apparel,Topwear,Kurtas,Blue,2012,Ethnic,Aurelia Women Printed Blue Kurta
28752,Women,Apparel,Topwear,Kurtas,Orange,2012,Ethnic,Aurelia Women Printed Orange Kurta
28753,Women,Apparel,Topwear,Kurtas,Green,2012,Ethnic,Aurelia Women Printed Green Kurta
28754,Women,Apparel,Topwear,Kurtas,Blue,2012,Ethnic,Aurelia Women Printed Blue Kurta
28755,Women,Apparel,Topwear,Kurtas,Purple,2012,Ethnic,Aurelia Women Printed Purple Kurta
28757,Women,Apparel,Topwear,Kurtas,Green,2012,Ethnic,Aurelia Women Green Kurta
28758,Women,Apparel,Topwear,Kurtas,Blue,2012,Ethnic,Aurelia Women Blue Kurta
28760,Women,Apparel,Topwear,Kurtas,Peach,2012,Ethnic,Aurelia Women Peach Kurta
28761,Women,Apparel,Topwear,Kurtas,Beige,2012,Ethnic,Aurelia Women Beige Kurta
28762,Women,Apparel,Topwear,Kurtas,Red,2012,Ethnic,Aurelia Women Red Kurta
28763,Women,Apparel,Topwear,Kurtas,Maroon,2012,Ethnic,Aurelia Women Maroon Kurta
28764,Women,Apparel,Topwear,Kurtas,Beige,2012,Ethnic,Aurelia Women Beige Kurta
28765,Women,Apparel,Topwear,Kurtas,White,2012,Ethnic,Aurelia Women Printed White Kurta
28766,Women,Apparel,Topwear,Kurtas,Brown,2012,Ethnic,Aurelia Women Printed Brown Kurta
28767,Women,Apparel,Topwear,Kurtas,Red,2012,Ethnic,Aurelia Women Striped Red Kurta
28768,Women,Apparel,Topwear,Kurtas,Beige,2012,Ethnic,Aurelia Women Striped Beige Kurta
28834,Women,Apparel,Topwear,Kurtas,Multi,2012,Ethnic,Biba Women Printed Multi Coloured Kurta
28835,Women,Apparel,Topwear,Kurtas,Multi,2012,Ethnic,BIBA Women Printed Multi Coloured Kurta
28836,Women,Apparel,Topwear,Kurtas,Multi,2012,Ethnic,BIBA Women Printed Multi Coloured Kurta
28871,Women,Apparel,Topwear,Kurtas,Turquoise Blue,2012,Ethnic,BIBA Women Printed Turquoise Blue Kurta
28872,Women,Apparel,Topwear,Kurtas,Multi,2012,Ethnic,BIBA Women Printed Multi Coloured Kurta
28873,Women,Apparel,Topwear,Kurtas,Green,2012,Ethnic,BIBA Women Bohemian Green Kurta
28874,Women,Apparel,Topwear,Kurtas,Blue,2012,Ethnic,BIBA Women Printed Blue Kurta
28875,Women,Apparel,Topwear,Kurtas,Multi,2012,Ethnic,BIBA Women Printed Multi Coloured Kurta
28877,Women,Apparel,Topwear,Kurtas,Yellow,2012,Ethnic,BIBA Women Printed Yellow Kurta
28905,Women,Apparel,Topwear,Kurtas,Multi,2012,Ethnic,BIBA Women Printed Multi Coloured Kurta
28906,Women,Apparel,Topwear,Kurtas,Blue,2012,Ethnic,BIBA Women Printed Blue Kurta
28907,Women,Apparel,Topwear,Kurtas,White,2012,Ethnic,Biba Women Printed White & Purple Kurta
28908,Women,Apparel,Topwear,Kurtas,Red,2012,Ethnic,BIBA Women Printed Red Kurta
28909,Women,Apparel,Topwear,Kurtas,Red,2012,Ethnic,BIBA Women Printed Red Kurta
28910,Women,Apparel,Topwear,Kurtas,White,2012,Ethnic,BIBA Women White Kurta
28936,Women,Apparel,Topwear,Kurtas,Pink,2012,Ethnic,BIBA Women Printed Pink Kurta
28937,Women,Apparel,Topwear,Kurtas,Black,2012,Ethnic,BIBA Women Printed Black Kurta
28938,Women,Apparel,Topwear,Kurtas,Blue,2012,Ethnic,BIBA Women Printed Blue Kurta
28939,Women,Apparel,Topwear,Kurtas,Pink,2012,Ethnic,BIBA Women Printed Pink Kurta
28940,Women,Apparel,Topwear,Kurtas,Pink,2012,Ethnic,BIBA Women Printed Pink Kurta
28941,Women,Apparel,Topwear,Kurtas,Green,2012,Ethnic,BIBA Women Ethnic Green Kurta
28942,Women,Apparel,Topwear,Kurtas,Yellow,2012,Ethnic,BIBA Women Yellow Kurta
28947,Women,Apparel,Topwear,Kurtas,White,2012,Ethnic,BIBA Women Ethnic White Kurta
28948,Women,Apparel,Topwear,Kurtas,White,2012,Ethnic,BIBA Women Ethnic White Kurta
28954,Women,Apparel,Topwear,Kurtas,White,2012,Ethnic,BIBA Women Dyed White Kurta
28955,Women,Apparel,Topwear,Kurtas,White,2012,Ethnic,BIBA Women White Kurta
28957,Women,Apparel,Topwear,Kurtas,White,2012,Ethnic,BIBA Women Printed White Kurta
